1550760503.680774 00:10:db:ff:70:02 > 08:00:27:b1:f9:b7, ethertype IPv6 (0x86dd), length 6856: (flowlabel 0x2b831, hlim 58, next-header TCP (6) payload length: 6802) 2001:41b0:fe:8::10.443 > 2001:4878:a225:3000:a00:27ff:feb1:f9b7.52364: Flags [.], cksum 0xe267 (incorrect -> 0x7a06), seq 2191069328:2191076098, ack 3684024811, win 429, options [nop,nop,TS val 1310895664 ecr 1533555129], length 6770
1550760503.680803 00:10:db:ff:70:02 > 08:00:27:b1:f9:b7, ethertype IPv6 (0x86dd), length 6856: (flowlabel 0x2b831, hlim 58, next-header TCP (6) payload length: 6802) 2001:41b0:fe:8::10.443 > 2001:4878:a225:3000:a00:27ff:feb1:f9b7.52364: Flags [.], cksum 0xe267 (incorrect -> 0xbc54), seq 6770:13540, ack 1, win 429, options [nop,nop,TS val 1310895665 ecr 1533555129], length 6770
1550760503.680856 00:10:db:ff:70:02 > 08:00:27:b1:f9:b7, ethertype IPv6 (0x86dd), length 1440: (flowlabel 0x2b831, hlim 58, next-header TCP (6) payload length: 1386) 2001:41b0:fe:8::10.443 > 2001:4878:a225:3000:a00:27ff:feb1:f9b7.52364: Flags [.], cksum 0x3477 (correct), seq 13540:14894, ack 1, win 429, options [nop,nop,TS val 1310895666 ecr 1533555129], length 1354
1550760503.685334 00:10:db:ff:70:02 > 08:00:27:b1:f9:b7, ethertype IPv6 (0x86dd), length 4148: (flowlabel 0x2b831, hlim 58, next-header TCP (6) payload length: 4094) 2001:41b0:fe:8::10.443 > 2001:4878:a225:3000:a00:27ff:feb1:f9b7.52364: Flags [.], cksum 0xd7d3 (incorrect -> 0x488c), seq 14894:18956, ack 1, win 429, options [nop,nop,TS val 1310895666 ecr 1533555129], length 4062
1550760503.686207 08:00:27:b1:f9:b7 > 00:10:db:ff:70:02, ethertype IPv6 (0x86dd), length 86: (flowlabel 0xd773a, hlim 64, next-header TCP (6) payload length: 32) 2001:4878:a225:3000:a00:27ff:feb1:f9b7.52364 > 2001:41b0:fe:8::10.443: Flags [.], cksum 0xc7f5 (incorrect -> 0x8eca), ack 18956, win 19849, options [nop,nop,TS val 1533555176 ecr 1310895656], length 0
1550760503.688479 00:10:db:ff:70:02 > 08:00:27:b1:f9:b7, ethertype IPv6 (0x86dd), length 1440: (flowlabel 0x2b831, hlim 58, next-header TCP (6) payload length: 1386) 2001:41b0:fe:8::10.443 > 2001:4878:a225:3000:a00:27ff:feb1:f9b7.52364: Flags [.], cksum 0x7dec (correct), seq 18956:20310, ack 1, win 429, options [nop,nop,TS val 1310895666 ecr 1533555129], length 1354
1550760503.688528 00:10:db:ff:70:02 > 08:00:27:b1:f9:b7, ethertype IPv6 (0x86dd), length 10918: (flowlabel 0x2b831, hlim 58, next-header TCP (6) payload length: 10864) 2001:41b0:fe:8::10.443 > 2001:4878:a225:3000:a00:27ff:feb1:f9b7.52364: Flags [.], cksum 0xf245 (incorrect -> 0x66fb), seq 20310:31142, ack 1, win 429, options [nop,nop,TS val 1310895667 ecr 1533555129], length 10832
1550760503.688554 08:00:27:b1:f9:b7 > 00:10:db:ff:70:02, ethertype IPv6 (0x86dd), length 86: (flowlabel 0xd773a, hlim 64, next-header TCP (6) payload length: 32) 2001:4878:a225:3000:a00:27ff:feb1:f9b7.52364 > 2001:41b0:fe:8::10.443: Flags [.], cksum 0xc7f5 (incorrect -> 0x5da3), ack 31142, win 20234, options [nop,nop,TS val 1533555178 ecr 1310895666], length 0
1550760503.688601 00:10:db:ff:70:02 > 08:00:27:b1:f9:b7, ethertype IPv6 (0x86dd), length 6856: (flowlabel 0x2b831, hlim 58, next-header TCP (6) payload length: 6802) 2001:41b0:fe:8::10.443 > 2001:4878:a225:3000:a00:27ff:feb1:f9b7.52364: Flags [.], cksum 0xe267 (incorrect -> 0x1d66), seq 31142:37912, ack 1, win 429, options [nop,nop,TS val 1310895668 ecr 1533555129], length 6770
1550760503.688698 00:10:db:ff:70:02 > 08:00:27:b1:f9:b7, ethertype IPv6 (0x86dd), length 6856: (flowlabel 0x2b831, hlim 58, next-header TCP (6) payload length: 6802) 2001:41b0:fe:8::10.443 > 2001:4878:a225:3000:a00:27ff:feb1:f9b7.52364: Flags [.], cksum 0xe267 (incorrect -> 0xac5e), seq 37912:44682, ack 1, win 429, options [nop,nop,TS val 1310895669 ecr 1533555129], length 6770
1550760503.688727 00:10:db:ff:70:02 > 08:00:27:b1:f9:b7, ethertype IPv6 (0x86dd), length 6856: (flowlabel 0x2b831, hlim 58, next-header TCP (6) payload length: 6802) 2001:41b0:fe:8::10.443 > 2001:4878:a225:3000:a00:27ff:feb1:f9b7.52364: Flags [.], cksum 0xe267 (incorrect -> 0xeb6b), seq 44682:51452, ack 1, win 429, options [nop,nop,TS val 1310895670 ecr 1533555129], length 6770
1550760503.688797 00:10:db:ff:70:02 > 08:00:27:b1:f9:b7, ethertype IPv6 (0x86dd), length 10918: (flowlabel 0x2b831, hlim 58, next-header TCP (6) payload length: 10864) 2001:41b0:fe:8::10.443 > 2001:4878:a225:3000:a00:27ff:feb1:f9b7.52364: Flags [.], cksum 0xf245 (incorrect -> 0xcb1d), seq 51452:62284, ack 1, win 429, options [nop,nop,TS val 1310895671 ecr 1533555129], length 10832
1550760503.688821 00:10:db:ff:70:02 > 08:00:27:b1:f9:b7, ethertype IPv6 (0x86dd), length 4148: (flowlabel 0x2b831, hlim 58, next-header TCP (6) payload length: 4094) 2001:41b0:fe:8::10.443 > 2001:4878:a225:3000:a00:27ff:feb1:f9b7.52364: Flags [.], cksum 0xd7d3 (incorrect -> 0xa831), seq 62284:66346, ack 1, win 429, options [nop,nop,TS val 1310895672 ecr 1533555135], length 4062
1550760503.688837 00:10:db:ff:70:02 > 08:00:27:b1:f9:b7, ethertype IPv6 (0x86dd), length 6856: (flowlabel 0x2b831, hlim 58, next-header TCP (6) payload length: 6802) 2001:41b0:fe:8::10.443 > 2001:4878:a225:3000:a00:27ff:feb1:f9b7.52364: Flags [.], cksum 0xe267 (incorrect -> 0xf93c), seq 69054:75824, ack 1, win 429, options [nop,nop,TS val 1310895673 ecr 1533555137], length 6770
1550760503.688855 08:00:27:b1:f9:b7 > 00:10:db:ff:70:02, ethertype IPv6 (0x86dd), length 98: (flowlabel 0xd773a, hlim 64, next-header TCP (6) payload length: 44) 2001:4878:a225:3000:a00:27ff:feb1:f9b7.52364 > 2001:41b0:fe:8::10.443: Flags [.], cksum 0xc801 (incorrect -> 0x42ac), ack 66346, win 19999, options [nop,nop,TS val 1533555179 ecr 1310895668,nop,nop,sack 1 {69054:75824}], length 0
1550760503.688941 00:10:db:ff:70:02 > 08:00:27:b1:f9:b7, ethertype IPv6 (0x86dd), length 6856: (flowlabel 0x2b831, hlim 58, next-header TCP (6) payload length: 6802) 2001:41b0:fe:8::10.443 > 2001:4878:a225:3000:a00:27ff:feb1:f9b7.52364: Flags [.], cksum 0xe267 (incorrect -> 0x7fe8), seq 75824:82594, ack 1, win 429, options [nop,nop,TS val 1310895674 ecr 1533555137], length 6770
1550760503.688975 08:00:27:b1:f9:b7 > 00:10:db:ff:70:02, ethertype IPv6 (0x86dd), length 98: (flowlabel 0xd773a, hlim 64, next-header TCP (6) payload length: 44) 2001:4878:a225:3000:a00:27ff:feb1:f9b7.52364 > 2001:41b0:fe:8::10.443: Flags [.], cksum 0xc801 (incorrect -> 0x283a), ack 66346, win 19999, options [nop,nop,TS val 1533555179 ecr 1310895668,nop,nop,sack 1 {69054:82594}], length 0
1550760503.689082 00:10:db:ff:70:02 > 08:00:27:b1:f9:b7, ethertype IPv6 (0x86dd), length 1440: (flowlabel 0x2b831, hlim 58, next-header TCP (6) payload length: 1386) 2001:41b0:fe:8::10.443 > 2001:4878:a225:3000:a00:27ff:feb1:f9b7.52364: Flags [.], cksum 0x3b2f (correct), seq 82594:83948, ack 1, win 429, options [nop,nop,TS val 1310895675 ecr 1533555137], length 1354
1550760503.689104 08:00:27:b1:f9:b7 > 00:10:db:ff:70:02, ethertype IPv6 (0x86dd), length 98: (flowlabel 0xd773a, hlim 64, next-header TCP (6) payload length: 44) 2001:4878:a225:3000:a00:27ff:feb1:f9b7.52364 > 2001:41b0:fe:8::10.443: Flags [.], cksum 0xc801 (incorrect -> 0x22f0), ack 66346, win 19999, options [nop,nop,TS val 1533555179 ecr 1310895668,nop,nop,sack 1 {69054:83948}], length 0
1550760503.690086 00:10:db:ff:70:02 > 08:00:27:b1:f9:b7, ethertype IPv6 (0x86dd), length 9564: (flowlabel 0x2b831, hlim 58, next-header TCP (6) payload length: 9510) 2001:41b0:fe:8::10.443 > 2001:4878:a225:3000:a00:27ff:feb1:f9b7.52364: Flags [.], cksum 0xecfb (incorrect -> 0x57f6), seq 83948:93426, ack 1, win 429, options [nop,nop,TS val 1310895675 ecr 1533555137], length 9478
1550760503.690122 08:00:27:b1:f9:b7 > 00:10:db:ff:70:02, ethertype IPv6 (0x86dd), length 98: (flowlabel 0xd773a, hlim 64, next-header TCP (6) payload length: 44) 2001:4878:a225:3000:a00:27ff:feb1:f9b7.52364 > 2001:41b0:fe:8::10.443: Flags [.], cksum 0xc801 (incorrect -> 0xfde8), ack 66346, win 19999, options [nop,nop,TS val 1533555180 ecr 1310895668,nop,nop,sack 1 {69054:93426}], length 0
1550760503.690548 00:10:db:ff:70:02 > 08:00:27:b1:f9:b7, ethertype IPv6 (0x86dd), length 1440: (flowlabel 0x2b831, hlim 58, next-header TCP (6) payload length: 1386) 2001:41b0:fe:8::10.443 > 2001:4878:a225:3000:a00:27ff:feb1:f9b7.52364: Flags [.], cksum 0x04ba (correct), seq 93426:94780, ack 1, win 429, options [nop,nop,TS val 1310895676 ecr 1533555137], length 1354
1550760503.690578 08:00:27:b1:f9:b7 > 00:10:db:ff:70:02, ethertype IPv6 (0x86dd), length 98: (flowlabel 0xd773a, hlim 64, next-header TCP (6) payload length: 44) 2001:4878:a225:3000:a00:27ff:feb1:f9b7.52364 > 2001:41b0:fe:8::10.443: Flags [.], cksum 0xc801 (incorrect -> 0xf89e), ack 66346, win 19999, options [nop,nop,TS val 1533555180 ecr 1310895668,nop,nop,sack 1 {69054:94780}], length 0
1550760503.696763 00:10:db:ff:70:02 > 08:00:27:b1:f9:b7, ethertype IPv6 (0x86dd), length 4148: (flowlabel 0x2b831, hlim 58, next-header TCP (6) payload length: 4094) 2001:41b0:fe:8::10.443 > 2001:4878:a225:3000:a00:27ff:feb1:f9b7.52364: Flags [.], cksum 0xd7d3 (incorrect -> 0x58c0), seq 94780:98842, ack 1, win 429, options [nop,nop,TS val 1310895676 ecr 1533555137], length 4062
1550760503.696803 08:00:27:b1:f9:b7 > 00:10:db:ff:70:02, ethertype IPv6 (0x86dd), length 98: (flowlabel 0xd773a, hlim 64, next-header TCP (6) payload length: 44) 2001:4878:a225:3000:a00:27ff:feb1:f9b7.52364 > 2001:41b0:fe:8::10.443: Flags [.], cksum 0xc801 (incorrect -> 0xe830), ack 66346, win 20136, options [nop,nop,TS val 1533555187 ecr 1310895668,nop,nop,sack 1 {69054:98842}], length 0
1550760503.698714 00:10:db:ff:70:02 > 08:00:27:b1:f9:b7, ethertype IPv6 (0x86dd), length 1440: (flowlabel 0x2b831, hlim 58, next-header TCP (6) payload length: 1386) 2001:41b0:fe:8::10.443 > 2001:4878:a225:3000:a00:27ff:feb1:f9b7.52364: Flags [.], cksum 0x9440 (correct), seq 98842:100196, ack 1, win 429, options [nop,nop,TS val 1310895676 ecr 1533555137], length 1354
1550760503.698745 08:00:27:b1:f9:b7 > 00:10:db:ff:70:02, ethertype IPv6 (0x86dd), length 98: (flowlabel 0xd773a, hlim 64, next-header TCP (6) payload length: 44) 2001:4878:a225:3000:a00:27ff:feb1:f9b7.52364 > 2001:41b0:fe:8::10.443: Flags [.], cksum 0xc801 (incorrect -> 0xe2e5), ack 66346, win 20136, options [nop,nop,TS val 1533555188 ecr 1310895668,nop,nop,sack 1 {69054:100196}], length 0
1550760503.698793 00:10:db:ff:70:02 > 08:00:27:b1:f9:b7, ethertype IPv6 (0x86dd), length 6856: (flowlabel 0x2b831, hlim 58, next-header TCP (6) payload length: 6802) 2001:41b0:fe:8::10.443 > 2001:4878:a225:3000:a00:27ff:feb1:f9b7.52364: Flags [.], cksum 0xe267 (incorrect -> 0xcb34), seq 100196:106966, ack 1, win 429, options [nop,nop,TS val 1310895677 ecr 1533555137], length 6770
1550760503.698809 08:00:27:b1:f9:b7 > 00:10:db:ff:70:02, ethertype IPv6 (0x86dd), length 98: (flowlabel 0xd773a, hlim 64, next-header TCP (6) payload length: 44) 2001:4878:a225:3000:a00:27ff:feb1:f9b7.52364 > 2001:41b0:fe:8::10.443: Flags [.], cksum 0xc801 (incorrect -> 0xc872), ack 66346, win 20136, options [nop,nop,TS val 1533555189 ecr 1310895668,nop,nop,sack 1 {69054:106966}], length 0
1550760503.698964 00:10:db:ff:70:02 > 08:00:27:b1:f9:b7, ethertype IPv6 (0x86dd), length 6856: (flowlabel 0x2b831, hlim 58, next-header TCP (6) payload length: 6802) 2001:41b0:fe:8::10.443 > 2001:4878:a225:3000:a00:27ff:feb1:f9b7.52364: Flags [.], cksum 0xe267 (incorrect -> 0x1789), seq 106966:113736, ack 1, win 429, options [nop,nop,TS val 1310895678 ecr 1533555139], length 6770
1550760503.698994 08:00:27:b1:f9:b7 > 00:10:db:ff:70:02, ethertype IPv6 (0x86dd), length 98: (flowlabel 0xd773a, hlim 64, next-header TCP (6) payload length: 44) 2001:4878:a225:3000:a00:27ff:feb1:f9b7.52364 > 2001:41b0:fe:8::10.443: Flags [.], cksum 0xc801 (incorrect -> 0xae00), ack 66346, win 20136, options [nop,nop,TS val 1533555189 ecr 1310895668,nop,nop,sack 1 {69054:113736}], length 0
1550760503.699026 00:10:db:ff:70:02 > 08:00:27:b1:f9:b7, ethertype IPv6 (0x86dd), length 4148: (flowlabel 0x2b831, hlim 58, next-header TCP (6) payload length: 4094) 2001:41b0:fe:8::10.443 > 2001:4878:a225:3000:a00:27ff:feb1:f9b7.52364: Flags [.], cksum 0xd7d3 (incorrect -> 0x8e2e), seq 113736:117798, ack 1, win 429, options [nop,nop,TS val 1310895679 ecr 1533555139], length 4062
1550760503.699035 08:00:27:b1:f9:b7 > 00:10:db:ff:70:02, ethertype IPv6 (0x86dd), length 98: (flowlabel 0xd773a, hlim 64, next-header TCP (6) payload length: 44) 2001:4878:a225:3000:a00:27ff:feb1:f9b7.52364 > 2001:41b0:fe:8::10.443: Flags [.], cksum 0xc801 (incorrect -> 0x9e22), ack 66346, win 20136, options [nop,nop,TS val 1533555189 ecr 1310895668,nop,nop,sack 1 {69054:117798}], length 0
1550760503.699100 00:10:db:ff:70:02 > 08:00:27:b1:f9:b7, ethertype IPv6 (0x86dd), length 6856: (flowlabel 0x2b831, hlim 58, next-header TCP (6) payload length: 6802) 2001:41b0:fe:8::10.443 > 2001:4878:a225:3000:a00:27ff:feb1:f9b7.52364: Flags [.], cksum 0xe267 (incorrect -> 0x8b5a), seq 117798:124568, ack 1, win 429, options [nop,nop,TS val 1310895680 ecr 1533555139], length 6770
1550760503.699117 08:00:27:b1:f9:b7 > 00:10:db:ff:70:02, ethertype IPv6 (0x86dd), length 98: (flowlabel 0xd773a, hlim 64, next-header TCP (6) payload length: 44) 2001:4878:a225:3000:a00:27ff:feb1:f9b7.52364 > 2001:41b0:fe:8::10.443: Flags [.], cksum 0xc801 (incorrect -> 0x83b0), ack 66346, win 20136, options [nop,nop,TS val 1533555189 ecr 1310895668,nop,nop,sack 1 {69054:124568}], length 0
1550760503.699258 00:10:db:ff:70:02 > 08:00:27:b1:f9:b7, ethertype IPv6 (0x86dd), length 5502: (flowlabel 0x2b831, hlim 58, next-header TCP (6) payload length: 5448) 2001:41b0:fe:8::10.443 > 2001:4878:a225:3000:a00:27ff:feb1:f9b7.52364: Flags [.], cksum 0xdd1d (incorrect -> 0x12d7), seq 124568:129984, ack 1, win 429, options [nop,nop,TS val 1310895681 ecr 1533555139], length 5416
1550760503.699280 08:00:27:b1:f9:b7 > 00:10:db:ff:70:02, ethertype IPv6 (0x86dd), length 98: (flowlabel 0xd773a, hlim 64, next-header TCP (6) payload length: 44) 2001:4878:a225:3000:a00:27ff:feb1:f9b7.52364 > 2001:41b0:fe:8::10.443: Flags [.], cksum 0xc801 (incorrect -> 0x6e88), ack 66346, win 20136, options [nop,nop,TS val 1533555189 ecr 1310895668,nop,nop,sack 1 {69054:129984}], length 0
1550760503.700652 00:10:db:ff:70:02 > 08:00:27:b1:f9:b7, ethertype IPv6 (0x86dd), length 1440: (flowlabel 0x2b831, hlim 58, next-header TCP (6) payload length: 1386) 2001:41b0:fe:8::10.443 > 2001:4878:a225:3000:a00:27ff:feb1:f9b7.52364: Flags [.], cksum 0xe8ef (correct), seq 129984:131338, ack 1, win 429, options [nop,nop,TS val 1310895681 ecr 1533555139], length 1354
1550760503.700727 08:00:27:b1:f9:b7 > 00:10:db:ff:70:02, ethertype IPv6 (0x86dd), length 98: (flowlabel 0xd773a, hlim 64, next-header TCP (6) payload length: 44) 2001:4878:a225:3000:a00:27ff:feb1:f9b7.52364 > 2001:41b0:fe:8::10.443: Flags [.], cksum 0xc801 (incorrect -> 0x693d), ack 66346, win 20136, options [nop,nop,TS val 1533555190 ecr 1310895668,nop,nop,sack 1 {69054:131338}], length 0
1550760503.700780 00:10:db:ff:70:02 > 08:00:27:b1:f9:b7, ethertype IPv6 (0x86dd), length 13626: (flowlabel 0x2b831, hlim 58, next-header TCP (6) payload length: 13572) 2001:41b0:fe:8::10.443 > 2001:4878:a225:3000:a00:27ff:feb1:f9b7.52364: Flags [.], cksum 0xfcd9 (incorrect -> 0xfa74), seq 131338:144878, ack 1, win 429, options [nop,nop,TS val 1310895682 ecr 1533555139], length 13540
1550760503.700800 08:00:27:b1:f9:b7 > 00:10:db:ff:70:02, ethertype IPv6 (0x86dd), length 98: (flowlabel 0xd773a, hlim 64, next-header TCP (6) payload length: 44) 2001:4878:a225:3000:a00:27ff:feb1:f9b7.52364 > 2001:41b0:fe:8::10.443: Flags [.], cksum 0xc801 (incorrect -> 0x3458), ack 66346, win 20136, options [nop,nop,TS val 1533555191 ecr 1310895668,nop,nop,sack 1 {69054:144878}], length 0
1550760503.700824 00:10:db:ff:70:02 > 08:00:27:b1:f9:b7, ethertype IPv6 (0x86dd), length 4148: (flowlabel 0x2b831, hlim 58, next-header TCP (6) payload length: 4094) 2001:41b0:fe:8::10.443 > 2001:4878:a225:3000:a00:27ff:feb1:f9b7.52364: Flags [.], cksum 0xd7d3 (incorrect -> 0x6665), seq 144878:148940, ack 1, win 429, options [nop,nop,TS val 1310895683 ecr 1533555139], length 4062
1550760503.700835 08:00:27:b1:f9:b7 > 00:10:db:ff:70:02, ethertype IPv6 (0x86dd), length 98: (flowlabel 0xd773a, hlim 64, next-header TCP (6) payload length: 44) 2001:4878:a225:3000:a00:27ff:feb1:f9b7.52364 > 2001:41b0:fe:8::10.443: Flags [.], cksum 0xc801 (incorrect -> 0x247a), ack 66346, win 20136, options [nop,nop,TS val 1533555191 ecr 1310895668,nop,nop,sack 1 {69054:148940}], length 0
1550760503.700903 00:10:db:ff:70:02 > 08:00:27:b1:f9:b7, ethertype IPv6 (0x86dd), length 2794: (flowlabel 0x2b831, hlim 58, next-header TCP (6) payload length: 2740) 2001:41b0:fe:8::10.443 > 2001:4878:a225:3000:a00:27ff:feb1:f9b7.52364: Flags [.], cksum 0xd289 (incorrect -> 0x3de9), seq 148940:151648, ack 1, win 429, options [nop,nop,TS val 1310895684 ecr 1533555139], length 2708
1550760503.700920 08:00:27:b1:f9:b7 > 00:10:db:ff:70:02, ethertype IPv6 (0x86dd), length 98: (flowlabel 0xd773a, hlim 64, next-header TCP (6) payload length: 44) 2001:4878:a225:3000:a00:27ff:feb1:f9b7.52364 > 2001:41b0:fe:8::10.443: Flags [.], cksum 0xc801 (incorrect -> 0x19e6), ack 66346, win 20136, options [nop,nop,TS val 1533555191 ecr 1310895668,nop,nop,sack 1 {69054:151648}], length 0
1550760503.700945 00:10:db:ff:70:02 > 08:00:27:b1:f9:b7, ethertype IPv6 (0x86dd), length 2794: (flowlabel 0x2b831, hlim 58, next-header TCP (6) payload length: 2740) 2001:41b0:fe:8::10.443 > 2001:4878:a225:3000:a00:27ff:feb1:f9b7.52364: Flags [.], cksum 0xd289 (incorrect -> 0xc6c1), seq 153002:155710, ack 1, win 429, options [nop,nop,TS val 1310895684 ecr 1533555139], length 2708
1550760503.700957 08:00:27:b1:f9:b7 > 00:10:db:ff:70:02, ethertype IPv6 (0x86dd), length 106: (flowlabel 0xd773a, hlim 64, next-header TCP (6) payload length: 52) 2001:4878:a225:3000:a00:27ff:feb1:f9b7.52364 > 2001:41b0:fe:8::10.443: Flags [.], cksum 0xc809 (incorrect -> 0x1d96), ack 66346, win 20136, options [nop,nop,TS val 1533555191 ecr 1310895668,nop,nop,sack 2 {153002:155710}{69054:151648}], length 0
1550760503.700991 00:10:db:ff:70:02 > 08:00:27:b1:f9:b7, ethertype IPv6 (0x86dd), length 6856: (flowlabel 0x2b831, hlim 58, next-header TCP (6) payload length: 6802) 2001:41b0:fe:8::10.443 > 2001:4878:a225:3000:a00:27ff:feb1:f9b7.52364: Flags [.], cksum 0xe267 (incorrect -> 0x0f7b), seq 155710:162480, ack 1, win 429, options [nop,nop,TS val 1310895685 ecr 1533555139], length 6770
1550760503.701007 08:00:27:b1:f9:b7 > 00:10:db:ff:70:02, ethertype IPv6 (0x86dd), length 106: (flowlabel 0xd773a, hlim 64, next-header TCP (6) payload length: 52) 2001:4878:a225:3000:a00:27ff:feb1:f9b7.52364 > 2001:41b0:fe:8::10.443: Flags [.], cksum 0xc809 (incorrect -> 0x0324), ack 66346, win 20136, options [nop,nop,TS val 1533555191 ecr 1310895668,nop,nop,sack 2 {153002:162480}{69054:151648}], length 0
1550760503.701025 00:10:db:ff:70:02 > 08:00:27:b1:f9:b7, ethertype IPv6 (0x86dd), length 4148: (flowlabel 0x2b831, hlim 58, next-header TCP (6) payload length: 4094) 2001:41b0:fe:8::10.443 > 2001:4878:a225:3000:a00:27ff:feb1:f9b7.52364: Flags [.], cksum 0xd7d3 (incorrect -> 0x556f), seq 162480:166542, ack 1, win 429, options [nop,nop,TS val 1310895686 ecr 1533555139], length 4062
1550760503.701034 08:00:27:b1:f9:b7 > 00:10:db:ff:70:02, ethertype IPv6 (0x86dd), length 106: (flowlabel 0xd773a, hlim 64, next-header TCP (6) payload length: 52) 2001:4878:a225:3000:a00:27ff:feb1:f9b7.52364 > 2001:41b0:fe:8::10.443: Flags [.], cksum 0xc809 (incorrect -> 0xf345), ack 66346, win 20136, options [nop,nop,TS val 1533555191 ecr 1310895668,nop,nop,sack 2 {153002:166542}{69054:151648}], length 0
1550760503.701047 00:10:db:ff:70:02 > 08:00:27:b1:f9:b7, ethertype IPv6 (0x86dd), length 1440: (flowlabel 0x2b831, hlim 58, next-header TCP (6) payload length: 1386) 2001:41b0:fe:8::10.443 > 2001:4878:a225:3000:a00:27ff:feb1:f9b7.52364: Flags [.], cksum 0x0342 (correct), seq 167896:169250, ack 1, win 429, options [nop,nop,TS val 1310895686 ecr 1533555139], length 1354
1550760503.701055 08:00:27:b1:f9:b7 > 00:10:db:ff:70:02, ethertype IPv6 (0x86dd), length 114: (flowlabel 0xd773a, hlim 64, next-header TCP (6) payload length: 60) 2001:4878:a225:3000:a00:27ff:feb1:f9b7.52364 > 2001:41b0:fe:8::10.443: Flags [.], cksum 0xc811 (incorrect -> 0x87e3), ack 66346, win 20136, options [nop,nop,TS val 1533555191 ecr 1310895668,nop,nop,sack 3 {167896:169250}{153002:166542}{69054:151648}], length 0
1550760503.701117 00:10:db:ff:70:02 > 08:00:27:b1:f9:b7, ethertype IPv6 (0x86dd), length 6856: (flowlabel 0x2b831, hlim 58, next-header TCP (6) payload length: 6802) 2001:41b0:fe:8::10.443 > 2001:4878:a225:3000:a00:27ff:feb1:f9b7.52364: Flags [.], cksum 0xe267 (incorrect -> 0x5dec), seq 169250:176020, ack 1, win 429, options [nop,nop,TS val 1310895687 ecr 1533555139], length 6770
1550760503.701144 08:00:27:b1:f9:b7 > 00:10:db:ff:70:02, ethertype IPv6 (0x86dd), length 114: (flowlabel 0xd773a, hlim 64, next-header TCP (6) payload length: 60) 2001:4878:a225:3000:a00:27ff:feb1:f9b7.52364 > 2001:41b0:fe:8::10.443: Flags [.], cksum 0xc811 (incorrect -> 0x6d71), ack 66346, win 20136, options [nop,nop,TS val 1533555191 ecr 1310895668,nop,nop,sack 3 {167896:176020}{153002:166542}{69054:151648}], length 0
1550760503.701239 00:10:db:ff:70:02 > 08:00:27:b1:f9:b7, ethertype IPv6 (0x86dd), length 2794: (flowlabel 0x2b831, hlim 58, next-header TCP (6) payload length: 2740) 2001:41b0:fe:8::10.443 > 2001:4878:a225:3000:a00:27ff:feb1:f9b7.52364: Flags [.], cksum 0xd289 (incorrect -> 0x1121), seq 176020:178728, ack 1, win 429, options [nop,nop,TS val 1310895688 ecr 1533555139], length 2708
1550760503.701257 08:00:27:b1:f9:b7 > 00:10:db:ff:70:02, ethertype IPv6 (0x86dd), length 114: (flowlabel 0xd773a, hlim 64, next-header TCP (6) payload length: 60) 2001:4878:a225:3000:a00:27ff:feb1:f9b7.52364 > 2001:41b0:fe:8::10.443: Flags [.], cksum 0xc811 (incorrect -> 0x62dd), ack 66346, win 20136, options [nop,nop,TS val 1533555191 ecr 1310895668,nop,nop,sack 3 {167896:178728}{153002:166542}{69054:151648}], length 0
1550760503.707848 00:10:db:ff:70:02 > 08:00:27:b1:f9:b7, ethertype IPv6 (0x86dd), length 8210: (flowlabel 0x2b831, hlim 58, next-header TCP (6) payload length: 8156) 2001:41b0:fe:8::10.443 > 2001:4878:a225:3000:a00:27ff:feb1:f9b7.52364: Flags [.], cksum 0xe7b1 (incorrect -> 0xc900), seq 178728:186852, ack 1, win 429, options [nop,nop,TS val 1310895688 ecr 1533555139], length 8124
1550760503.707902 08:00:27:b1:f9:b7 > 00:10:db:ff:70:02, ethertype IPv6 (0x86dd), length 114: (flowlabel 0xd773a, hlim 64, next-header TCP (6) payload length: 60) 2001:4878:a225:3000:a00:27ff:feb1:f9b7.52364 > 2001:41b0:fe:8::10.443: Flags [.], cksum 0xc811 (incorrect -> 0x431a), ack 66346, win 20136, options [nop,nop,TS val 1533555198 ecr 1310895668,nop,nop,sack 3 {167896:186852}{153002:166542}{69054:151648}], length 0
1550760503.707952 00:10:db:ff:70:02 > 08:00:27:b1:f9:b7, ethertype IPv6 (0x86dd), length 6856: (flowlabel 0x2b831, hlim 58, next-header TCP (6) payload length: 6802) 2001:41b0:fe:8::10.443 > 2001:4878:a225:3000:a00:27ff:feb1:f9b7.52364: Flags [.], cksum 0xe267 (incorrect -> 0xfa55), seq 186852:193622, ack 1, win 429, options [nop,nop,TS val 1310895689 ecr 1533555139], length 6770
1550760503.707972 08:00:27:b1:f9:b7 > 00:10:db:ff:70:02, ethertype IPv6 (0x86dd), length 114: (flowlabel 0xd773a, hlim 64, next-header TCP (6) payload length: 60) 2001:4878:a225:3000:a00:27ff:feb1:f9b7.52364 > 2001:41b0:fe:8::10.443: Flags [.], cksum 0xc811 (incorrect -> 0x28a8), ack 66346, win 20136, options [nop,nop,TS val 1533555198 ecr 1310895668,nop,nop,sack 3 {167896:193622}{153002:166542}{69054:151648}], length 0
1550760503.708053 00:10:db:ff:70:02 > 08:00:27:b1:f9:b7, ethertype IPv6 (0x86dd), length 6856: (flowlabel 0x2b831, hlim 58, next-header TCP (6) payload length: 6802) 2001:41b0:fe:8::10.443 > 2001:4878:a225:3000:a00:27ff:feb1:f9b7.52364: Flags [.], cksum 0xe267 (incorrect -> 0x3d9a), seq 193622:200392, ack 1, win 429, options [nop,nop,TS val 1310895690 ecr 1533555139], length 6770
1550760503.708080 08:00:27:b1:f9:b7 > 00:10:db:ff:70:02, ethertype IPv6 (0x86dd), length 114: (flowlabel 0xd773a, hlim 64, next-header TCP (6) payload length: 60) 2001:4878:a225:3000:a00:27ff:feb1:f9b7.52364 > 2001:41b0:fe:8::10.443: Flags [.], cksum 0xc811 (incorrect -> 0x0e36), ack 66346, win 20136, options [nop,nop,TS val 1533555198 ecr 1310895668,nop,nop,sack 3 {167896:200392}{153002:166542}{69054:151648}], length 0
1550760503.708157 00:10:db:ff:70:02 > 08:00:27:b1:f9:b7, ethertype IPv6 (0x86dd), length 5502: (flowlabel 0x2b831, hlim 58, next-header TCP (6) payload length: 5448) 2001:41b0:fe:8::10.443 > 2001:4878:a225:3000:a00:27ff:feb1:f9b7.52364: Flags [.], cksum 0xdd1d (incorrect -> 0x4faf), seq 200392:205808, ack 1, win 429, options [nop,nop,TS val 1310895691 ecr 1533555139], length 5416
1550760503.708183 08:00:27:b1:f9:b7 > 00:10:db:ff:70:02, ethertype IPv6 (0x86dd), length 114: (flowlabel 0xd773a, hlim 64, next-header TCP (6) payload length: 60) 2001:4878:a225:3000:a00:27ff:feb1:f9b7.52364 > 2001:41b0:fe:8::10.443: Flags [.], cksum 0xc811 (incorrect -> 0xf90d), ack 66346, win 20136, options [nop,nop,TS val 1533555198 ecr 1310895668,nop,nop,sack 3 {167896:205808}{153002:166542}{69054:151648}], length 0
1550760503.709311 00:10:db:ff:70:02 > 08:00:27:b1:f9:b7, ethertype IPv6 (0x86dd), length 1440: (flowlabel 0x2b831, hlim 58, next-header TCP (6) payload length: 1386) 2001:41b0:fe:8::10.443 > 2001:4878:a225:3000:a00:27ff:feb1:f9b7.52364: Flags [.], cksum 0xea03 (correct), seq 205808:207162, ack 1, win 429, options [nop,nop,TS val 1310895691 ecr 1533555139], length 1354
1550760503.709335 08:00:27:b1:f9:b7 > 00:10:db:ff:70:02, ethertype IPv6 (0x86dd), length 114: (flowlabel 0xd773a, hlim 64, next-header TCP (6) payload length: 60) 2001:4878:a225:3000:a00:27ff:feb1:f9b7.52364 > 2001:41b0:fe:8::10.443: Flags [.], cksum 0xc811 (incorrect -> 0xf3c2), ack 66346, win 20136, options [nop,nop,TS val 1533555199 ecr 1310895668,nop,nop,sack 3 {167896:207162}{153002:166542}{69054:151648}], length 0
1550760503.709441 00:10:db:ff:70:02 > 08:00:27:b1:f9:b7, ethertype IPv6 (0x86dd), length 10918: (flowlabel 0x2b831, hlim 58, next-header TCP (6) payload length: 10864) 2001:41b0:fe:8::10.443 > 2001:4878:a225:3000:a00:27ff:feb1:f9b7.52364: Flags [.], cksum 0xf245 (incorrect -> 0x4229), seq 207162:217994, ack 1, win 429, options [nop,nop,TS val 1310895692 ecr 1533555139], length 10832
1550760503.709480 08:00:27:b1:f9:b7 > 00:10:db:ff:70:02, ethertype IPv6 (0x86dd), length 114: (flowlabel 0xd773a, hlim 64, next-header TCP (6) payload length: 60) 2001:4878:a225:3000:a00:27ff:feb1:f9b7.52364 > 2001:41b0:fe:8::10.443: Flags [.], cksum 0xc811 (incorrect -> 0xc972), ack 66346, win 20136, options [nop,nop,TS val 1533555199 ecr 1310895668,nop,nop,sack 3 {167896:217994}{153002:166542}{69054:151648}], length 0
1550760503.709523 00:10:db:ff:70:02 > 08:00:27:b1:f9:b7, ethertype IPv6 (0x86dd), length 6856: (flowlabel 0x2b831, hlim 58, next-header TCP (6) payload length: 6802) 2001:41b0:fe:8::10.443 > 2001:4878:a225:3000:a00:27ff:feb1:f9b7.52364: Flags [.], cksum 0xe267 (incorrect -> 0xb83e), seq 217994:224764, ack 1, win 429, options [nop,nop,TS val 1310895693 ecr 1533555139], length 6770
1550760503.709538 08:00:27:b1:f9:b7 > 00:10:db:ff:70:02, ethertype IPv6 (0x86dd), length 114: (flowlabel 0xd773a, hlim 64, next-header TCP (6) payload length: 60) 2001:4878:a225:3000:a00:27ff:feb1:f9b7.52364 > 2001:41b0:fe:8::10.443: Flags [.], cksum 0xc811 (incorrect -> 0xaf00), ack 66346, win 20136, options [nop,nop,TS val 1533555199 ecr 1310895668,nop,nop,sack 3 {167896:224764}{153002:166542}{69054:151648}], length 0
1550760503.709622 00:10:db:ff:70:02 > 08:00:27:b1:f9:b7, ethertype IPv6 (0x86dd), length 6856: (flowlabel 0x2b831, hlim 58, next-header TCP (6) payload length: 6802) 2001:41b0:fe:8::10.443 > 2001:4878:a225:3000:a00:27ff:feb1:f9b7.52364: Flags [.], cksum 0xe267 (incorrect -> 0x634d), seq 224764:231534, ack 1, win 429, options [nop,nop,TS val 1310895694 ecr 1533555139], length 6770
1550760503.709645 08:00:27:b1:f9:b7 > 00:10:db:ff:70:02, ethertype IPv6 (0x86dd), length 114: (flowlabel 0xd773a, hlim 64, next-header TCP (6) payload length: 60) 2001:4878:a225:3000:a00:27ff:feb1:f9b7.52364 > 2001:41b0:fe:8::10.443: Flags [.], cksum 0xc811 (incorrect -> 0x948e), ack 66346, win 20136, options [nop,nop,TS val 1533555199 ecr 1310895668,nop,nop,sack 3 {167896:231534}{153002:166542}{69054:151648}], length 0
1550760503.709731 00:10:db:ff:70:02 > 08:00:27:b1:f9:b7, ethertype IPv6 (0x86dd), length 6856: (flowlabel 0x2b831, hlim 58, next-header TCP (6) payload length: 6802) 2001:41b0:fe:8::10.443 > 2001:4878:a225:3000:a00:27ff:feb1:f9b7.52364: Flags [.], cksum 0xe267 (incorrect -> 0x9db5), seq 231534:238304, ack 1, win 429, options [nop,nop,TS val 1310895695 ecr 1533555139], length 6770
1550760503.709754 08:00:27:b1:f9:b7 > 00:10:db:ff:70:02, ethertype IPv6 (0x86dd), length 114: (flowlabel 0xd773a, hlim 64, next-header TCP (6) payload length: 60) 2001:4878:a225:3000:a00:27ff:feb1:f9b7.52364 > 2001:41b0:fe:8::10.443: Flags [.], cksum 0xc811 (incorrect -> 0x7a1c), ack 66346, win 20136, options [nop,nop,TS val 1533555199 ecr 1310895668,nop,nop,sack 3 {167896:238304}{153002:166542}{69054:151648}], length 0
1550760503.710520 00:10:db:ff:70:02 > 08:00:27:b1:f9:b7, ethertype IPv6 (0x86dd), length 12272: (flowlabel 0x2b831, hlim 58, next-header TCP (6) payload length: 12218) 2001:41b0:fe:8::10.443 > 2001:4878:a225:3000:a00:27ff:feb1:f9b7.52364: Flags [.], cksum 0xf78f (incorrect -> 0xfcc9), seq 238304:250490, ack 1, win 429, options [nop,nop,TS val 1310895696 ecr 1533555157], length 12186
1550760503.710552 08:00:27:b1:f9:b7 > 00:10:db:ff:70:02, ethertype IPv6 (0x86dd), length 114: (flowlabel 0xd773a, hlim 64, next-header TCP (6) payload length: 60) 2001:4878:a225:3000:a00:27ff:feb1:f9b7.52364 > 2001:41b0:fe:8::10.443: Flags [.], cksum 0xc811 (incorrect -> 0x4a81), ack 66346, win 20136, options [nop,nop,TS val 1533555200 ecr 1310895668,nop,nop,sack 3 {167896:250490}{153002:166542}{69054:151648}], length 0
1550760503.710786 00:10:db:ff:70:02 > 08:00:27:b1:f9:b7, ethertype IPv6 (0x86dd), length 4148: (flowlabel 0x2b831, hlim 58, next-header TCP (6) payload length: 4094) 2001:41b0:fe:8::10.443 > 2001:4878:a225:3000:a00:27ff:feb1:f9b7.52364: Flags [.], cksum 0xd7d3 (incorrect -> 0x5049), seq 250490:254552, ack 1, win 429, options [nop,nop,TS val 1310895697 ecr 1533555157], length 4062
1550760503.710834 08:00:27:b1:f9:b7 > 00:10:db:ff:70:02, ethertype IPv6 (0x86dd), length 114: (flowlabel 0xd773a, hlim 64, next-header TCP (6) payload length: 60) 2001:4878:a225:3000:a00:27ff:feb1:f9b7.52364 > 2001:41b0:fe:8::10.443: Flags [.], cksum 0xc811 (incorrect -> 0x3aa2), ack 66346, win 20136, options [nop,nop,TS val 1533555201 ecr 1310895668,nop,nop,sack 3 {167896:254552}{153002:166542}{69054:151648}], length 0
1550760503.715979 00:10:db:ff:70:02 > 08:00:27:b1:f9:b7, ethertype IPv6 (0x86dd), length 4148: (flowlabel 0x2b831, hlim 58, next-header TCP (6) payload length: 4094) 2001:41b0:fe:8::10.443 > 2001:4878:a225:3000:a00:27ff:feb1:f9b7.52364: Flags [.], cksum 0xd7d3 (incorrect -> 0xf012), seq 254552:258614, ack 1, win 429, options [nop,nop,TS val 1310895697 ecr 1533555157], length 4062
1550760503.716023 08:00:27:b1:f9:b7 > 00:10:db:ff:70:02, ethertype IPv6 (0x86dd), length 114: (flowlabel 0xd773a, hlim 64, next-header TCP (6) payload length: 60) 2001:4878:a225:3000:a00:27ff:feb1:f9b7.52364 > 2001:41b0:fe:8::10.443: Flags [.], cksum 0xc811 (incorrect -> 0x2abf), ack 66346, win 20136, options [nop,nop,TS val 1533555206 ecr 1310895668,nop,nop,sack 3 {167896:258614}{153002:166542}{69054:151648}], length 0
1550760503.717959 00:10:db:ff:70:02 > 08:00:27:b1:f9:b7, ethertype IPv6 (0x86dd), length 8210: (flowlabel 0x2b831, hlim 58, next-header TCP (6) payload length: 8156) 2001:41b0:fe:8::10.443 > 2001:4878:a225:3000:a00:27ff:feb1:f9b7.52364: Flags [.], cksum 0xe7b1 (incorrect -> 0xe56c), seq 258614:266738, ack 1, win 429, options [nop,nop,TS val 1310895698 ecr 1533555157], length 8124
1550760503.718004 08:00:27:b1:f9:b7 > 00:10:db:ff:70:02, ethertype IPv6 (0x86dd), length 114: (flowlabel 0xd773a, hlim 64, next-header TCP (6) payload length: 60) 2001:4878:a225:3000:a00:27ff:feb1:f9b7.52364 > 2001:41b0:fe:8::10.443: Flags [.], cksum 0xc811 (incorrect -> 0x0b01), ack 66346, win 20136, options [nop,nop,TS val 1533555208 ecr 1310895668,nop,nop,sack 3 {167896:266738}{153002:166542}{69054:151648}], length 0
1550760503.718271 00:10:db:ff:70:02 > 08:00:27:b1:f9:b7, ethertype IPv6 (0x86dd), length 6856: (flowlabel 0x2b831, hlim 58, next-header TCP (6) payload length: 6802) 2001:41b0:fe:8::10.443 > 2001:4878:a225:3000:a00:27ff:feb1:f9b7.52364: Flags [.], cksum 0xe267 (incorrect -> 0x0715), seq 266738:273508, ack 1, win 429, options [nop,nop,TS val 1310895699 ecr 1533555157], length 6770
1550760503.718306 08:00:27:b1:f9:b7 > 00:10:db:ff:70:02, ethertype IPv6 (0x86dd), length 114: (flowlabel 0xd773a, hlim 64, next-header TCP (6) payload length: 60) 2001:4878:a225:3000:a00:27ff:feb1:f9b7.52364 > 2001:41b0:fe:8::10.443: Flags [.], cksum 0xc811 (incorrect -> 0xf08e), ack 66346, win 20136, options [nop,nop,TS val 1533555208 ecr 1310895668,nop,nop,sack 3 {167896:273508}{153002:166542}{69054:151648}], length 0
1550760503.718462 00:10:db:ff:70:02 > 08:00:27:b1:f9:b7, ethertype IPv6 (0x86dd), length 8210: (flowlabel 0x2b831, hlim 58, next-header TCP (6) payload length: 8156) 2001:41b0:fe:8::10.443 > 2001:4878:a225:3000:a00:27ff:feb1:f9b7.52364: Flags [.], cksum 0xe7b1 (incorrect -> 0x978f), seq 273508:281632, ack 1, win 429, options [nop,nop,TS val 1310895700 ecr 1533555157], length 8124
1550760503.718497 08:00:27:b1:f9:b7 > 00:10:db:ff:70:02, ethertype IPv6 (0x86dd), length 114: (flowlabel 0xd773a, hlim 64, next-header TCP (6) payload length: 60) 2001:4878:a225:3000:a00:27ff:feb1:f9b7.52364 > 2001:41b0:fe:8::10.443: Flags [.], cksum 0xc811 (incorrect -> 0xd0d2), ack 66346, win 20136, options [nop,nop,TS val 1533555208 ecr 1310895668,nop,nop,sack 3 {167896:281632}{153002:166542}{69054:151648}], length 0
1550760503.718542 00:10:db:ff:70:02 > 08:00:27:b1:f9:b7, ethertype IPv6 (0x86dd), length 8210: (flowlabel 0x2b831, hlim 58, next-header TCP (6) payload length: 8156) 2001:41b0:fe:8::10.443 > 2001:4878:a225:3000:a00:27ff:feb1:f9b7.52364: Flags [.], cksum 0xe7b1 (incorrect -> 0x710b), seq 281632:289756, ack 1, win 429, options [nop,nop,TS val 1310895701 ecr 1533555157], length 8124
1550760503.718560 08:00:27:b1:f9:b7 > 00:10:db:ff:70:02, ethertype IPv6 (0x86dd), length 114: (flowlabel 0xd773a, hlim 64, next-header TCP (6) payload length: 60) 2001:4878:a225:3000:a00:27ff:feb1:f9b7.52364 > 2001:41b0:fe:8::10.443: Flags [.], cksum 0xc811 (incorrect -> 0xb116), ack 66346, win 20136, options [nop,nop,TS val 1533555208 ecr 1310895668,nop,nop,sack 3 {167896:289756}{153002:166542}{69054:151648}], length 0
1550760503.718805 00:10:db:ff:70:02 > 08:00:27:b1:f9:b7, ethertype IPv6 (0x86dd), length 4148: (flowlabel 0x2b831, hlim 58, next-header TCP (6) payload length: 4094) 2001:41b0:fe:8::10.443 > 2001:4878:a225:3000:a00:27ff:feb1:f9b7.52364: Flags [.], cksum 0xd7d3 (incorrect -> 0x0ca3), seq 289756:293818, ack 1, win 429, options [nop,nop,TS val 1310895702 ecr 1533555157], length 4062
1550760503.718827 08:00:27:b1:f9:b7 > 00:10:db:ff:70:02, ethertype IPv6 (0x86dd), length 114: (flowlabel 0xd773a, hlim 64, next-header TCP (6) payload length: 60) 2001:4878:a225:3000:a00:27ff:feb1:f9b7.52364 > 2001:41b0:fe:8::10.443: Flags [.], cksum 0xc811 (incorrect -> 0xa137), ack 66346, win 20136, options [nop,nop,TS val 1533555209 ecr 1310895668,nop,nop,sack 3 {167896:293818}{153002:166542}{69054:151648}], length 0
1550760503.719880 00:10:db:ff:70:02 > 08:00:27:b1:f9:b7, ethertype IPv6 (0x86dd), length 86: (flowlabel 0xf6b48, hlim 121, next-header TCP (6) payload length: 32) 2a00:1450:401b:803::200e.443 > 2001:4878:a225:3000:a00:27ff:feb1:f9b7.58822: Flags [.], cksum 0x1ef2 (correct), ack 3956168904, win 1050, options [nop,nop,TS val 3960622608 ecr 3226023597], length 0
1550760503.719913 00:10:db:ff:70:02 > 08:00:27:b1:f9:b7, ethertype IPv6 (0x86dd), length 10918: (flowlabel 0x2b831, hlim 58, next-header TCP (6) payload length: 10864) 2001:41b0:fe:8::10.443 > 2001:4878:a225:3000:a00:27ff:feb1:f9b7.52364: Flags [.], cksum 0xf245 (incorrect -> 0x366c), seq 293818:304650, ack 1, win 429, options [nop,nop,TS val 1310895702 ecr 1533555157], length 10832
1550760503.719939 08:00:27:b1:f9:b7 > 00:10:db:ff:70:02, ethertype IPv6 (0x86dd), length 114: (flowlabel 0xd773a, hlim 64, next-header TCP (6) payload length: 60) 2001:4878:a225:3000:a00:27ff:feb1:f9b7.52364 > 2001:41b0:fe:8::10.443: Flags [.], cksum 0xc811 (incorrect -> 0x76e6), ack 66346, win 20136, options [nop,nop,TS val 1533555210 ecr 1310895668,nop,nop,sack 3 {167896:304650}{153002:166542}{69054:151648}], length 0
1550760503.720051 00:10:db:ff:70:02 > 08:00:27:b1:f9:b7, ethertype IPv6 (0x86dd), length 8210: (flowlabel 0x2b831, hlim 58, next-header TCP (6) payload length: 8156) 2001:41b0:fe:8::10.443 > 2001:4878:a225:3000:a00:27ff:feb1:f9b7.52364: Flags [.], cksum 0xe7b1 (incorrect -> 0x2b6d), seq 304650:312774, ack 1, win 429, options [nop,nop,TS val 1310895703 ecr 1533555157], length 8124
1550760503.720078 08:00:27:b1:f9:b7 > 00:10:db:ff:70:02, ethertype IPv6 (0x86dd), length 114: (flowlabel 0xd773a, hlim 64, next-header TCP (6) payload length: 60) 2001:4878:a225:3000:a00:27ff:feb1:f9b7.52364 > 2001:41b0:fe:8::10.443: Flags [.], cksum 0xc811 (incorrect -> 0x572a), ack 66346, win 20136, options [nop,nop,TS val 1533555210 ecr 1310895668,nop,nop,sack 3 {167896:312774}{153002:166542}{69054:151648}], length 0
1550760503.720177 00:10:db:ff:70:02 > 08:00:27:b1:f9:b7, ethertype IPv6 (0x86dd), length 8210: (flowlabel 0x2b831, hlim 58, next-header TCP (6) payload length: 8156) 2001:41b0:fe:8::10.443 > 2001:4878:a225:3000:a00:27ff:feb1:f9b7.52364: Flags [.], cksum 0xe7b1 (incorrect -> 0x1689), seq 312774:320898, ack 1, win 429, options [nop,nop,TS val 1310895704 ecr 1533555166], length 8124
1550760503.720206 08:00:27:b1:f9:b7 > 00:10:db:ff:70:02, ethertype IPv6 (0x86dd), length 114: (flowlabel 0xd773a, hlim 64, next-header TCP (6) payload length: 60) 2001:4878:a225:3000:a00:27ff:feb1:f9b7.52364 > 2001:41b0:fe:8::10.443: Flags [.], cksum 0xc811 (incorrect -> 0x376e), ack 66346, win 20136, options [nop,nop,TS val 1533555210 ecr 1310895668,nop,nop,sack 3 {167896:320898}{153002:166542}{69054:151648}], length 0
1550760503.720311 00:10:db:ff:70:02 > 08:00:27:b1:f9:b7, ethertype IPv6 (0x86dd), length 8210: (flowlabel 0x2b831, hlim 58, next-header TCP (6) payload length: 8156) 2001:41b0:fe:8::10.443 > 2001:4878:a225:3000:a00:27ff:feb1:f9b7.52364: Flags [.], cksum 0xe7b1 (incorrect -> 0xd71f), seq 320898:329022, ack 1, win 429, options [nop,nop,TS val 1310895705 ecr 1533555166], length 8124
1550760503.720339 08:00:27:b1:f9:b7 > 00:10:db:ff:70:02, ethertype IPv6 (0x86dd), length 114: (flowlabel 0xd773a, hlim 64, next-header TCP (6) payload length: 60) 2001:4878:a225:3000:a00:27ff:feb1:f9b7.52364 > 2001:41b0:fe:8::10.443: Flags [.], cksum 0xc811 (incorrect -> 0x17b2), ack 66346, win 20136, options [nop,nop,TS val 1533555210 ecr 1310895668,nop,nop,sack 3 {167896:329022}{153002:166542}{69054:151648}], length 0
1550760503.720534 00:10:db:ff:70:02 > 08:00:27:b1:f9:b7, ethertype IPv6 (0x86dd), length 5502: (flowlabel 0x2b831, hlim 58, next-header TCP (6) payload length: 5448) 2001:41b0:fe:8::10.443 > 2001:4878:a225:3000:a00:27ff:feb1:f9b7.52364: Flags [.], cksum 0xdd1d (incorrect -> 0x0adb), seq 329022:334438, ack 1, win 429, options [nop,nop,TS val 1310895706 ecr 1533555166], length 5416
