1550760470.297955 08:00:27:b1:f9:b7 > 00:10:db:ff:70:02, ethertype IPv6 (0x86dd), length 114: (flowlabel 0xd773a, hlim 64, next-header TCP (6) payload length: 60) 2001:4878:a225:3000:a00:27ff:feb1:f9b7.52364 > 2001:41b0:fe:8::10.443: Flags [.], cksum 0xc811 (incorrect -> 0xd329), ack 2186975062, win 20287, options [nop,nop,TS val 1533521804 ecr 1310862284,nop,nop,sack 3 {209871:230181}{20311:208517}{1355:18957}], length 0
1550760470.298162 00:10:db:ff:70:02 > 08:00:27:b1:f9:b7, ethertype IPv6 (0x86dd), length 5502: (flowlabel 0x2b831, hlim 58, next-header TCP (6) payload length: 5448) 2001:41b0:fe:8::10.443 > 2001:4878:a225:3000:a00:27ff:feb1:f9b7.52364: Flags [.], cksum 0xdd1d (incorrect -> 0x2b3a), seq 230181:235597, ack 0, win 391, options [nop,nop,TS val 1310862310 ecr 1533521771], length 5416
1550760470.298183 08:00:27:b1:f9:b7 > 00:10:db:ff:70:02, ethertype IPv6 (0x86dd), length 114: (flowlabel 0xd773a, hlim 64, next-header TCP (6) payload length: 60) 2001:4878:a225:3000:a00:27ff:feb1:f9b7.52364 > 2001:41b0:fe:8::10.443: Flags [.], cksum 0xc811 (incorrect -> 0xbe00), ack 1, win 20287, options [nop,nop,TS val 1533521805 ecr 1310862284,nop,nop,sack 3 {209871:235597}{20311:208517}{1355:18957}], length 0
1550760470.298833 00:10:db:ff:70:02 > 08:00:27:b1:f9:b7, ethertype IPv6 (0x86dd), length 2794: (flowlabel 0x2b831, hlim 58, next-header TCP (6) payload length: 2740) 2001:41b0:fe:8::10.443 > 2001:4878:a225:3000:a00:27ff:feb1:f9b7.52364: Flags [.], cksum 0xd289 (incorrect -> 0x9318), seq 235597:238305, ack 0, win 391, options [nop,nop,TS val 1310862311 ecr 1533521771], length 2708
1550760470.298846 08:00:27:b1:f9:b7 > 00:10:db:ff:70:02, ethertype IPv6 (0x86dd), length 114: (flowlabel 0xd773a, hlim 64, next-header TCP (6) payload length: 60) 2001:4878:a225:3000:a00:27ff:feb1:f9b7.52364 > 2001:41b0:fe:8::10.443: Flags [.], cksum 0xc811 (incorrect -> 0xb36c), ack 1, win 20287, options [nop,nop,TS val 1533521805 ecr 1310862284,nop,nop,sack 3 {209871:238305}{20311:208517}{1355:18957}], length 0
1550760470.304034 00:10:db:ff:70:02 > 08:00:27:b1:f9:b7, ethertype IPv6 (0x86dd), length 4148: (flowlabel 0x2b831, hlim 58, next-header TCP (6) payload length: 4094) 2001:41b0:fe:8::10.443 > 2001:4878:a225:3000:a00:27ff:feb1:f9b7.52364: Flags [.], cksum 0xd7d3 (incorrect -> 0xa8cd), seq 238305:242367, ack 0, win 391, options [nop,nop,TS val 1310862311 ecr 1533521771], length 4062
1550760470.304066 08:00:27:b1:f9:b7 > 00:10:db:ff:70:02, ethertype IPv6 (0x86dd), length 114: (flowlabel 0xd773a, hlim 64, next-header TCP (6) payload length: 60) 2001:4878:a225:3000:a00:27ff:feb1:f9b7.52364 > 2001:41b0:fe:8::10.443: Flags [.], cksum 0xc811 (incorrect -> 0xa389), ack 1, win 20287, options [nop,nop,TS val 1533521810 ecr 1310862284,nop,nop,sack 3 {209871:242367}{20311:208517}{1355:18957}], length 0
1550760470.306019 00:10:db:ff:70:02 > 08:00:27:b1:f9:b7, ethertype IPv6 (0x86dd), length 1440: (flowlabel 0x2b831, hlim 58, next-header TCP (6) payload length: 1386) 2001:41b0:fe:8::10.443 > 2001:4878:a225:3000:a00:27ff:feb1:f9b7.52364: Flags [.], cksum 0xa6a2 (correct), seq 242367:243721, ack 0, win 391, options [nop,nop,TS val 1310862311 ecr 1533521771], length 1354
1550760470.306112 08:00:27:b1:f9:b7 > 00:10:db:ff:70:02, ethertype IPv6 (0x86dd), length 114: (flowlabel 0xd773a, hlim 64, next-header TCP (6) payload length: 60) 2001:4878:a225:3000:a00:27ff:feb1:f9b7.52364 > 2001:41b0:fe:8::10.443: Flags [.], cksum 0xc811 (incorrect -> 0x9e3c), ack 1, win 20287, options [nop,nop,TS val 1533521813 ecr 1310862284,nop,nop,sack 3 {209871:243721}{20311:208517}{1355:18957}], length 0
1550760470.306156 00:10:db:ff:70:02 > 08:00:27:b1:f9:b7, ethertype IPv6 (0x86dd), length 14980: (flowlabel 0x2b831, hlim 58, next-header TCP (6) payload length: 14926) 2001:41b0:fe:8::10.443 > 2001:4878:a225:3000:a00:27ff:feb1:f9b7.52364: Flags [.], cksum 0x0224 (incorrect -> 0x55cc), seq 243721:258615, ack 0, win 391, options [nop,nop,TS val 1310862312 ecr 1533521771], length 14894
1550760470.306170 08:00:27:b1:f9:b7 > 00:10:db:ff:70:02, ethertype IPv6 (0x86dd), length 114: (flowlabel 0xd773a, hlim 64, next-header TCP (6) payload length: 60) 2001:4878:a225:3000:a00:27ff:feb1:f9b7.52364 > 2001:41b0:fe:8::10.443: Flags [.], cksum 0xc811 (incorrect -> 0x640e), ack 1, win 20287, options [nop,nop,TS val 1533521813 ecr 1310862284,nop,nop,sack 3 {209871:258615}{20311:208517}{1355:18957}], length 0
1550760470.306229 00:10:db:ff:70:02 > 08:00:27:b1:f9:b7, ethertype IPv6 (0x86dd), length 8210: (flowlabel 0x2b831, hlim 58, next-header TCP (6) payload length: 8156) 2001:41b0:fe:8::10.443 > 2001:4878:a225:3000:a00:27ff:feb1:f9b7.52364: Flags [.], cksum 0xe7b1 (incorrect -> 0xfc8f), seq 258615:266739, ack 0, win 391, options [nop,nop,TS val 1310862313 ecr 1533521771], length 8124
1550760470.306254 08:00:27:b1:f9:b7 > 00:10:db:ff:70:02, ethertype IPv6 (0x86dd), length 114: (flowlabel 0xd773a, hlim 64, next-header TCP (6) payload length: 60) 2001:4878:a225:3000:a00:27ff:feb1:f9b7.52364 > 2001:41b0:fe:8::10.443: Flags [.], cksum 0xc811 (incorrect -> 0x4452), ack 1, win 20287, options [nop,nop,TS val 1533521813 ecr 1310862284,nop,nop,sack 3 {209871:266739}{20311:208517}{1355:18957}], length 0
1550760470.306276 00:10:db:ff:70:02 > 08:00:27:b1:f9:b7, ethertype IPv6 (0x86dd), length 8210: (flowlabel 0x2b831, hlim 58, next-header TCP (6) payload length: 8156) 2001:41b0:fe:8::10.443 > 2001:4878:a225:3000:a00:27ff:feb1:f9b7.52364: Flags [.], cksum 0xe7b1 (incorrect -> 0xcfef), seq 266739:274863, ack 0, win 391, options [nop,nop,TS val 1310862314 ecr 1533521771], length 8124
1550760470.306287 08:00:27:b1:f9:b7 > 00:10:db:ff:70:02, ethertype IPv6 (0x86dd), length 114: (flowlabel 0xd773a, hlim 64, next-header TCP (6) payload length: 60) 2001:4878:a225:3000:a00:27ff:feb1:f9b7.52364 > 2001:41b0:fe:8::10.443: Flags [.], cksum 0xc811 (incorrect -> 0x2496), ack 1, win 20287, options [nop,nop,TS val 1533521813 ecr 1310862284,nop,nop,sack 3 {209871:274863}{20311:208517}{1355:18957}], length 0
1550760470.306341 00:10:db:ff:70:02 > 08:00:27:b1:f9:b7, ethertype IPv6 (0x86dd), length 4148: (flowlabel 0x2b831, hlim 58, next-header TCP (6) payload length: 4094) 2001:41b0:fe:8::10.443 > 2001:4878:a225:3000:a00:27ff:feb1:f9b7.52364: Flags [.], cksum 0xd7d3 (incorrect -> 0xbaf6), seq 274863:278925, ack 0, win 391, options [nop,nop,TS val 1310862315 ecr 1533521771], length 4062
1550760470.306360 08:00:27:b1:f9:b7 > 00:10:db:ff:70:02, ethertype IPv6 (0x86dd), length 114: (flowlabel 0xd773a, hlim 64, next-header TCP (6) payload length: 60) 2001:4878:a225:3000:a00:27ff:feb1:f9b7.52364 > 2001:41b0:fe:8::10.443: Flags [.], cksum 0xc811 (incorrect -> 0x14b8), ack 1, win 20287, options [nop,nop,TS val 1533521813 ecr 1310862284,nop,nop,sack 3 {209871:278925}{20311:208517}{1355:18957}], length 0
1550760470.307669 00:10:db:ff:70:02 > 08:00:27:b1:f9:b7, ethertype IPv6 (0x86dd), length 2794: (flowlabel 0x2b831, hlim 58, next-header TCP (6) payload length: 2740) 2001:41b0:fe:8::10.443 > 2001:4878:a225:3000:a00:27ff:feb1:f9b7.52364: Flags [.], cksum 0xd289 (incorrect -> 0x6440), seq 278925:281633, ack 0, win 391, options [nop,nop,TS val 1310862315 ecr 1533521771], length 2708
1550760470.307705 08:00:27:b1:f9:b7 > 00:10:db:ff:70:02, ethertype IPv6 (0x86dd), length 114: (flowlabel 0xd773a, hlim 64, next-header TCP (6) payload length: 60) 2001:4878:a225:3000:a00:27ff:feb1:f9b7.52364 > 2001:41b0:fe:8::10.443: Flags [.], cksum 0xc811 (incorrect -> 0x0a23), ack 1, win 20287, options [nop,nop,TS val 1533521814 ecr 1310862284,nop,nop,sack 3 {209871:281633}{20311:208517}{1355:18957}], length 0
1550760470.307735 00:10:db:ff:70:02 > 08:00:27:b1:f9:b7, ethertype IPv6 (0x86dd), length 8210: (flowlabel 0x2b831, hlim 58, next-header TCP (6) payload length: 8156) 2001:41b0:fe:8::10.443 > 2001:4878:a225:3000:a00:27ff:feb1:f9b7.52364: Flags [.], cksum 0xe7b1 (incorrect -> 0x2e2c), seq 281633:289757, ack 0, win 391, options [nop,nop,TS val 1310862316 ecr 1533521771], length 8124
1550760470.307743 08:00:27:b1:f9:b7 > 00:10:db:ff:70:02, ethertype IPv6 (0x86dd), length 114: (flowlabel 0xd773a, hlim 64, next-header TCP (6) payload length: 60) 2001:4878:a225:3000:a00:27ff:feb1:f9b7.52364 > 2001:41b0:fe:8::10.443: Flags [.], cksum 0xc811 (incorrect -> 0xea66), ack 1, win 20287, options [nop,nop,TS val 1533521814 ecr 1310862284,nop,nop,sack 3 {209871:289757}{20311:208517}{1355:18957}], length 0
1550760470.307754 00:10:db:ff:70:02 > 08:00:27:b1:f9:b7, ethertype IPv6 (0x86dd), length 1440: (flowlabel 0x2b831, hlim 58, next-header TCP (6) payload length: 1386) 2001:41b0:fe:8::10.443 > 2001:4878:a225:3000:a00:27ff:feb1:f9b7.52364: Flags [.], cksum 0x2276 (correct), seq 1:1355, ack 0, win 391, options [nop,nop,TS val 1310862317 ecr 1533521780], length 1354
1550760470.307772 08:00:27:b1:f9:b7 > 00:10:db:ff:70:02, ethertype IPv6 (0x86dd), length 106: (flowlabel 0xd773a, hlim 64, next-header TCP (6) payload length: 52) 2001:4878:a225:3000:a00:27ff:feb1:f9b7.52364 > 2001:41b0:fe:8::10.443: Flags [.], cksum 0xc809 (incorrect -> 0x4396), ack 18957, win 20139, options [nop,nop,TS val 1533521814 ecr 1310862317,nop,nop,sack 2 {209871:289757}{20311:208517}], length 0
1550760470.307788 00:10:db:ff:70:02 > 08:00:27:b1:f9:b7, ethertype IPv6 (0x86dd), length 1440: (flowlabel 0x2b831, hlim 58, next-header TCP (6) payload length: 1386) 2001:41b0:fe:8::10.443 > 2001:4878:a225:3000:a00:27ff:feb1:f9b7.52364: Flags [.], cksum 0xcabd (correct), seq 18957:20311, ack 0, win 391, options [nop,nop,TS val 1310862317 ecr 1533521782], length 1354
1550760470.307804 08:00:27:b1:f9:b7 > 00:10:db:ff:70:02, ethertype IPv6 (0x86dd), length 98: (flowlabel 0xd773a, hlim 64, next-header TCP (6) payload length: 44) 2001:4878:a225:3000:a00:27ff:feb1:f9b7.52364 > 2001:41b0:fe:8::10.443: Flags [.], cksum 0xc801 (incorrect -> 0x3613), ack 208517, win 18691, options [nop,nop,TS val 1533521814 ecr 1310862317,nop,nop,sack 1 {209871:289757}], length 0
1550760470.307824 00:10:db:ff:70:02 > 08:00:27:b1:f9:b7, ethertype IPv6 (0x86dd), length 5502: (flowlabel 0x2b831, hlim 58, next-header TCP (6) payload length: 5448) 2001:41b0:fe:8::10.443 > 2001:4878:a225:3000:a00:27ff:feb1:f9b7.52364: Flags [.], cksum 0xdd1d (incorrect -> 0xab24), seq 289757:295173, ack 0, win 391, options [nop,nop,TS val 1310862317 ecr 1533521782], length 5416
1550760470.307836 08:00:27:b1:f9:b7 > 00:10:db:ff:70:02, ethertype IPv6 (0x86dd), length 98: (flowlabel 0xd773a, hlim 64, next-header TCP (6) payload length: 44) 2001:4878:a225:3000:a00:27ff:feb1:f9b7.52364 > 2001:41b0:fe:8::10.443: Flags [.], cksum 0xc801 (incorrect -> 0x20eb), ack 208517, win 18691, options [nop,nop,TS val 1533521814 ecr 1310862317,nop,nop,sack 1 {209871:295173}], length 0
1550760470.307915 00:10:db:ff:70:02 > 08:00:27:b1:f9:b7, ethertype IPv6 (0x86dd), length 2794: (flowlabel 0x2b831, hlim 58, next-header TCP (6) payload length: 2740) 2001:41b0:fe:8::10.443 > 2001:4878:a225:3000:a00:27ff:feb1:f9b7.52364: Flags [.], cksum 0xd289 (incorrect -> 0x3be7), seq 295173:297881, ack 0, win 391, options [nop,nop,TS val 1310862317 ecr 1533521784], length 2708
1550760470.307938 08:00:27:b1:f9:b7 > 00:10:db:ff:70:02, ethertype IPv6 (0x86dd), length 98: (flowlabel 0xd773a, hlim 64, next-header TCP (6) payload length: 44) 2001:4878:a225:3000:a00:27ff:feb1:f9b7.52364 > 2001:41b0:fe:8::10.443: Flags [.], cksum 0xc801 (incorrect -> 0x1657), ack 208517, win 18691, options [nop,nop,TS val 1533521814 ecr 1310862317,nop,nop,sack 1 {209871:297881}], length 0
1550760470.307984 00:10:db:ff:70:02 > 08:00:27:b1:f9:b7, ethertype IPv6 (0x86dd), length 5502: (flowlabel 0x2b831, hlim 58, next-header TCP (6) payload length: 5448) 2001:41b0:fe:8::10.443 > 2001:4878:a225:3000:a00:27ff:feb1:f9b7.52364: Flags [.], cksum 0xdd1d (incorrect -> 0x7aa2), seq 297881:303297, ack 0, win 391, options [nop,nop,TS val 1310862318 ecr 1533521784], length 5416
1550760470.307998 08:00:27:b1:f9:b7 > 00:10:db:ff:70:02, ethertype IPv6 (0x86dd), length 98: (flowlabel 0xd773a, hlim 64, next-header TCP (6) payload length: 44) 2001:4878:a225:3000:a00:27ff:feb1:f9b7.52364 > 2001:41b0:fe:8::10.443: Flags [.], cksum 0xc801 (incorrect -> 0x012f), ack 208517, win 18691, options [nop,nop,TS val 1533521814 ecr 1310862317,nop,nop,sack 1 {209871:303297}], length 0
1550760470.310100 00:10:db:ff:70:02 > 08:00:27:b1:f9:b7, ethertype IPv6 (0x86dd), length 2794: (flowlabel 0x2b831, hlim 58, next-header TCP (6) payload length: 2740) 2001:41b0:fe:8::10.443 > 2001:4878:a225:3000:a00:27ff:feb1:f9b7.52364: Flags [.], cksum 0xd289 (incorrect -> 0x7f95), seq 303297:306005, ack 0, win 391, options [nop,nop,TS val 1310862318 ecr 1533521784], length 2708
1550760470.310119 08:00:27:b1:f9:b7 > 00:10:db:ff:70:02, ethertype IPv6 (0x86dd), length 98: (flowlabel 0xd773a, hlim 64, next-header TCP (6) payload length: 44) 2001:4878:a225:3000:a00:27ff:feb1:f9b7.52364 > 2001:41b0:fe:8::10.443: Flags [.], cksum 0xc801 (incorrect -> 0xf265), ack 208517, win 19765, options [nop,nop,TS val 1533521817 ecr 1310862317,nop,nop,sack 1 {209871:306005}], length 0
1550760470.310165 00:10:db:ff:70:02 > 08:00:27:b1:f9:b7, ethertype IPv6 (0x86dd), length 14980: (flowlabel 0x2b831, hlim 58, next-header TCP (6) payload length: 14926) 2001:41b0:fe:8::10.443 > 2001:4878:a225:3000:a00:27ff:feb1:f9b7.52364: Flags [.], cksum 0x0224 (incorrect -> 0xcd84), seq 306005:320899, ack 0, win 391, options [nop,nop,TS val 1310862319 ecr 1533521784], length 14894
1550760470.310180 08:00:27:b1:f9:b7 > 00:10:db:ff:70:02, ethertype IPv6 (0x86dd), length 98: (flowlabel 0xd773a, hlim 64, next-header TCP (6) payload length: 44) 2001:4878:a225:3000:a00:27ff:feb1:f9b7.52364 > 2001:41b0:fe:8::10.443: Flags [.], cksum 0xc801 (incorrect -> 0xb837), ack 208517, win 19765, options [nop,nop,TS val 1533521817 ecr 1310862317,nop,nop,sack 1 {209871:320899}], length 0
1550760470.314397 00:10:db:ff:70:02 > 08:00:27:b1:f9:b7, ethertype IPv6 (0x86dd), length 4148: (flowlabel 0x2b831, hlim 58, next-header TCP (6) payload length: 4094) 2001:41b0:fe:8::10.443 > 2001:4878:a225:3000:a00:27ff:feb1:f9b7.52364: Flags [.], cksum 0xd7d3 (incorrect -> 0x8c6d), seq 320899:324961, ack 0, win 391, options [nop,nop,TS val 1310862320 ecr 1533521784], length 4062
1550760470.314445 08:00:27:b1:f9:b7 > 00:10:db:ff:70:02, ethertype IPv6 (0x86dd), length 98: (flowlabel 0xd773a, hlim 64, next-header TCP (6) payload length: 44) 2001:4878:a225:3000:a00:27ff:feb1:f9b7.52364 > 2001:41b0:fe:8::10.443: Flags [.], cksum 0xc801 (incorrect -> 0xa855), ack 208517, win 19765, options [nop,nop,TS val 1533521821 ecr 1310862317,nop,nop,sack 1 {209871:324961}], length 0
1550760470.316359 00:10:db:ff:70:02 > 08:00:27:b1:f9:b7, ethertype IPv6 (0x86dd), length 4148: (flowlabel 0x2b831, hlim 58, next-header TCP (6) payload length: 4094) 2001:41b0:fe:8::10.443 > 2001:4878:a225:3000:a00:27ff:feb1:f9b7.52364: Flags [.], cksum 0xd7d3 (incorrect -> 0xd715), seq 324961:329023, ack 0, win 391, options [nop,nop,TS val 1310862320 ecr 1533521784], length 4062
1550760470.316397 08:00:27:b1:f9:b7 > 00:10:db:ff:70:02, ethertype IPv6 (0x86dd), length 98: (flowlabel 0xd773a, hlim 64, next-header TCP (6) payload length: 44) 2001:4878:a225:3000:a00:27ff:feb1:f9b7.52364 > 2001:41b0:fe:8::10.443: Flags [.], cksum 0xc801 (incorrect -> 0x9875), ack 208517, win 19765, options [nop,nop,TS val 1533521823 ecr 1310862317,nop,nop,sack 1 {209871:329023}], length 0
1550760470.316428 00:10:db:ff:70:02 > 08:00:27:b1:f9:b7, ethertype IPv6 (0x86dd), length 8210: (flowlabel 0x2b831, hlim 58, next-header TCP (6) payload length: 8156) 2001:41b0:fe:8::10.443 > 2001:4878:a225:3000:a00:27ff:feb1:f9b7.52364: Flags [.], cksum 0xe7b1 (incorrect -> 0x80ed), seq 329023:337147, ack 0, win 391, options [nop,nop,TS val 1310862321 ecr 1533521784], length 8124
1550760470.316438 08:00:27:b1:f9:b7 > 00:10:db:ff:70:02, ethertype IPv6 (0x86dd), length 98: (flowlabel 0xd773a, hlim 64, next-header TCP (6) payload length: 44) 2001:4878:a225:3000:a00:27ff:feb1:f9b7.52364 > 2001:41b0:fe:8::10.443: Flags [.], cksum 0xc801 (incorrect -> 0x78b9), ack 208517, win 19765, options [nop,nop,TS val 1533521823 ecr 1310862317,nop,nop,sack 1 {209871:337147}], length 0
1550760470.316453 00:10:db:ff:70:02 > 08:00:27:b1:f9:b7, ethertype IPv6 (0x86dd), length 6856: (flowlabel 0x2b831, hlim 58, next-header TCP (6) payload length: 6802) 2001:41b0:fe:8::10.443 > 2001:4878:a225:3000:a00:27ff:feb1:f9b7.52364: Flags [.], cksum 0xe267 (incorrect -> 0xfcf2), seq 337147:343917, ack 0, win 391, options [nop,nop,TS val 1310862322 ecr 1533521784], length 6770
1550760470.316462 08:00:27:b1:f9:b7 > 00:10:db:ff:70:02, ethertype IPv6 (0x86dd), length 98: (flowlabel 0xd773a, hlim 64, next-header TCP (6) payload length: 44) 2001:4878:a225:3000:a00:27ff:feb1:f9b7.52364 > 2001:41b0:fe:8::10.443: Flags [.], cksum 0xc801 (incorrect -> 0x5e47), ack 208517, win 19765, options [nop,nop,TS val 1533521823 ecr 1310862317,nop,nop,sack 1 {209871:343917}], length 0
1550760470.316513 00:10:db:ff:70:02 > 08:00:27:b1:f9:b7, ethertype IPv6 (0x86dd), length 8210: (flowlabel 0x2b831, hlim 58, next-header TCP (6) payload length: 8156) 2001:41b0:fe:8::10.443 > 2001:4878:a225:3000:a00:27ff:feb1:f9b7.52364: Flags [.], cksum 0xe7b1 (incorrect -> 0x46cf), seq 343917:352041, ack 0, win 391, options [nop,nop,TS val 1310862323 ecr 1533521784], length 8124
1550760470.316528 08:00:27:b1:f9:b7 > 00:10:db:ff:70:02, ethertype IPv6 (0x86dd), length 98: (flowlabel 0xd773a, hlim 64, next-header TCP (6) payload length: 44) 2001:4878:a225:3000:a00:27ff:feb1:f9b7.52364 > 2001:41b0:fe:8::10.443: Flags [.], cksum 0xc801 (incorrect -> 0x3e8b), ack 208517, win 19765, options [nop,nop,TS val 1533521823 ecr 1310862317,nop,nop,sack 1 {209871:352041}], length 0
1550760470.316578 00:10:db:ff:70:02 > 08:00:27:b1:f9:b7, ethertype IPv6 (0x86dd), length 6856: (flowlabel 0x2b831, hlim 58, next-header TCP (6) payload length: 6802) 2001:41b0:fe:8::10.443 > 2001:4878:a225:3000:a00:27ff:feb1:f9b7.52364: Flags [.], cksum 0xe267 (incorrect -> 0xb391), seq 352041:358811, ack 0, win 391, options [nop,nop,TS val 1310862324 ecr 1533521784], length 6770
1550760470.316593 08:00:27:b1:f9:b7 > 00:10:db:ff:70:02, ethertype IPv6 (0x86dd), length 98: (flowlabel 0xd773a, hlim 64, next-header TCP (6) payload length: 44) 2001:4878:a225:3000:a00:27ff:feb1:f9b7.52364 > 2001:41b0:fe:8::10.443: Flags [.], cksum 0xc801 (incorrect -> 0x2419), ack 208517, win 19765, options [nop,nop,TS val 1533521823 ecr 1310862317,nop,nop,sack 1 {209871:358811}], length 0
1550760470.317999 00:10:db:ff:70:02 > 08:00:27:b1:f9:b7, ethertype IPv6 (0x86dd), length 4148: (flowlabel 0x2b831, hlim 58, next-header TCP (6) payload length: 4094) 2001:41b0:fe:8::10.443 > 2001:4878:a225:3000:a00:27ff:feb1:f9b7.52364: Flags [.], cksum 0xd7d3 (incorrect -> 0x7d1d), seq 358811:362873, ack 0, win 391, options [nop,nop,TS val 1310862328 ecr 1533521792], length 4062
1550760470.318019 08:00:27:b1:f9:b7 > 00:10:db:ff:70:02, ethertype IPv6 (0x86dd), length 98: (flowlabel 0xd773a, hlim 64, next-header TCP (6) payload length: 44) 2001:4878:a225:3000:a00:27ff:feb1:f9b7.52364 > 2001:41b0:fe:8::10.443: Flags [.], cksum 0xc801 (incorrect -> 0x143a), ack 208517, win 19765, options [nop,nop,TS val 1533521824 ecr 1310862317,nop,nop,sack 1 {209871:362873}], length 0
1550760470.318065 00:10:db:ff:70:02 > 08:00:27:b1:f9:b7, ethertype IPv6 (0x86dd), length 5502: (flowlabel 0x2b831, hlim 58, next-header TCP (6) payload length: 5448) 2001:41b0:fe:8::10.443 > 2001:4878:a225:3000:a00:27ff:feb1:f9b7.52364: Flags [.], cksum 0xdd1d (incorrect -> 0x1765), seq 362873:368289, ack 0, win 391, options [nop,nop,TS val 1310862328 ecr 1533521794], length 5416
1550760470.318075 08:00:27:b1:f9:b7 > 00:10:db:ff:70:02, ethertype IPv6 (0x86dd), length 98: (flowlabel 0xd773a, hlim 64, next-header TCP (6) payload length: 44) 2001:4878:a225:3000:a00:27ff:feb1:f9b7.52364 > 2001:41b0:fe:8::10.443: Flags [.], cksum 0xc801 (incorrect -> 0xff11), ack 208517, win 19765, options [nop,nop,TS val 1533521824 ecr 1310862317,nop,nop,sack 1 {209871:368289}], length 0
1550760470.321086 00:10:db:ff:70:02 > 08:00:27:b1:f9:b7, ethertype IPv6 (0x86dd), length 1440: (flowlabel 0x2b831, hlim 58, next-header TCP (6) payload length: 1386) 2001:41b0:fe:8::10.443 > 2001:4878:a225:3000:a00:27ff:feb1:f9b7.52364: Flags [.], cksum 0xc125 (correct), seq 369643:370997, ack 0, win 391, options [nop,nop,TS val 1310862328 ecr 1533521794], length 1354
1550760470.321129 08:00:27:b1:f9:b7 > 00:10:db:ff:70:02, ethertype IPv6 (0x86dd), length 106: (flowlabel 0xd773a, hlim 64, next-header TCP (6) payload length: 52) 2001:4878:a225:3000:a00:27ff:feb1:f9b7.52364 > 2001:41b0:fe:8::10.443: Flags [.], cksum 0xc809 (incorrect -> 0x5e72), ack 208517, win 19765, options [nop,nop,TS val 1533521828 ecr 1310862317,nop,nop,sack 2 {369643:370997}{209871:368289}], length 0
1550760470.321174 00:10:db:ff:70:02 > 08:00:27:b1:f9:b7, ethertype IPv6 (0x86dd), length 4148: (flowlabel 0x2b831, hlim 58, next-header TCP (6) payload length: 4094) 2001:41b0:fe:8::10.443 > 2001:4878:a225:3000:a00:27ff:feb1:f9b7.52364: Flags [.], cksum 0xd7d3 (incorrect -> 0xfb89), seq 370997:375059, ack 0, win 391, options [nop,nop,TS val 1310862329 ecr 1533521795], length 4062
1550760470.321186 08:00:27:b1:f9:b7 > 00:10:db:ff:70:02, ethertype IPv6 (0x86dd), length 106: (flowlabel 0xd773a, hlim 64, next-header TCP (6) payload length: 52) 2001:4878:a225:3000:a00:27ff:feb1:f9b7.52364 > 2001:41b0:fe:8::10.443: Flags [.], cksum 0xc809 (incorrect -> 0x4e94), ack 208517, win 19765, options [nop,nop,TS val 1533521828 ecr 1310862317,nop,nop,sack 2 {369643:375059}{209871:368289}], length 0
1550760470.321207 00:10:db:ff:70:02 > 08:00:27:b1:f9:b7, ethertype IPv6 (0x86dd), length 9564: (flowlabel 0x2b831, hlim 58, next-header TCP (6) payload length: 9510) 2001:41b0:fe:8::10.443 > 2001:4878:a225:3000:a00:27ff:feb1:f9b7.52364: Flags [.], cksum 0xecfb (incorrect -> 0x256f), seq 376413:385891, ack 0, win 391, options [nop,nop,TS val 1310862329 ecr 1533521795], length 9478
1550760470.321219 08:00:27:b1:f9:b7 > 00:10:db:ff:70:02, ethertype IPv6 (0x86dd), length 114: (flowlabel 0xd773a, hlim 64, next-header TCP (6) payload length: 60) 2001:4878:a225:3000:a00:27ff:feb1:f9b7.52364 > 2001:41b0:fe:8::10.443: Flags [.], cksum 0xc811 (incorrect -> 0x5958), ack 208517, win 19765, options [nop,nop,TS val 1533521828 ecr 1310862317,nop,nop,sack 3 {376413:385891}{369643:375059}{209871:368289}], length 0
1550760470.321283 00:10:db:ff:70:02 > 08:00:27:b1:f9:b7, ethertype IPv6 (0x86dd), length 10918: (flowlabel 0x2b831, hlim 58, next-header TCP (6) payload length: 10864) 2001:41b0:fe:8::10.443 > 2001:4878:a225:3000:a00:27ff:feb1:f9b7.52364: Flags [.], cksum 0xf245 (incorrect -> 0xa612), seq 385891:396723, ack 0, win 391, options [nop,nop,TS val 1310862330 ecr 1533521795], length 10832
1550760470.321312 08:00:27:b1:f9:b7 > 00:10:db:ff:70:02, ethertype IPv6 (0x86dd), length 114: (flowlabel 0xd773a, hlim 64, next-header TCP (6) payload length: 60) 2001:4878:a225:3000:a00:27ff:feb1:f9b7.52364 > 2001:41b0:fe:8::10.443: Flags [.], cksum 0xc811 (incorrect -> 0x2f08), ack 208517, win 19765, options [nop,nop,TS val 1533521828 ecr 1310862317,nop,nop,sack 3 {376413:396723}{369643:375059}{209871:368289}], length 0
1550760470.321364 00:10:db:ff:70:02 > 08:00:27:b1:f9:b7, ethertype IPv6 (0x86dd), length 8210: (flowlabel 0x2b831, hlim 58, next-header TCP (6) payload length: 8156) 2001:41b0:fe:8::10.443 > 2001:4878:a225:3000:a00:27ff:feb1:f9b7.52364: Flags [.], cksum 0xe7b1 (incorrect -> 0x8676), seq 396723:404847, ack 0, win 391, options [nop,nop,TS val 1310862331 ecr 1533521795], length 8124
1550760470.321384 08:00:27:b1:f9:b7 > 00:10:db:ff:70:02, ethertype IPv6 (0x86dd), length 114: (flowlabel 0xd773a, hlim 64, next-header TCP (6) payload length: 60) 2001:4878:a225:3000:a00:27ff:feb1:f9b7.52364 > 2001:41b0:fe:8::10.443: Flags [.], cksum 0xc811 (incorrect -> 0x0f4c), ack 208517, win 19765, options [nop,nop,TS val 1533521828 ecr 1310862317,nop,nop,sack 3 {376413:404847}{369643:375059}{209871:368289}], length 0
1550760470.324513 00:10:db:ff:70:02 > 08:00:27:b1:f9:b7, ethertype IPv6 (0x86dd), length 1440: (flowlabel 0x2b831, hlim 58, next-header TCP (6) payload length: 1386) 2001:41b0:fe:8::10.443 > 2001:4878:a225:3000:a00:27ff:feb1:f9b7.52364: Flags [.], cksum 0x887a (correct), seq 404847:406201, ack 0, win 391, options [nop,nop,TS val 1310862331 ecr 1533521795], length 1354
1550760470.324545 08:00:27:b1:f9:b7 > 00:10:db:ff:70:02, ethertype IPv6 (0x86dd), length 114: (flowlabel 0xd773a, hlim 64, next-header TCP (6) payload length: 60) 2001:4878:a225:3000:a00:27ff:feb1:f9b7.52364 > 2001:41b0:fe:8::10.443: Flags [.], cksum 0xc811 (incorrect -> 0x09ff), ack 208517, win 19765, options [nop,nop,TS val 1533521831 ecr 1310862317,nop,nop,sack 3 {376413:406201}{369643:375059}{209871:368289}], length 0
1550760470.324615 00:10:db:ff:70:02 > 08:00:27:b1:f9:b7, ethertype IPv6 (0x86dd), length 5502: (flowlabel 0x2b831, hlim 58, next-header TCP (6) payload length: 5448) 2001:41b0:fe:8::10.443 > 2001:4878:a225:3000:a00:27ff:feb1:f9b7.52364: Flags [.], cksum 0xdd1d (incorrect -> 0xff2e), seq 406201:411617, ack 0, win 391, options [nop,nop,TS val 1310862332 ecr 1533521795], length 5416
1550760470.324633 08:00:27:b1:f9:b7 > 00:10:db:ff:70:02, ethertype IPv6 (0x86dd), length 114: (flowlabel 0xd773a, hlim 64, next-header TCP (6) payload length: 60) 2001:4878:a225:3000:a00:27ff:feb1:f9b7.52364 > 2001:41b0:fe:8::10.443: Flags [.], cksum 0xc811 (incorrect -> 0xf4d6), ack 208517, win 19765, options [nop,nop,TS val 1533521831 ecr 1310862317,nop,nop,sack 3 {376413:411617}{369643:375059}{209871:368289}], length 0
1550760470.326251 00:10:db:ff:70:02 > 08:00:27:b1:f9:b7, ethertype IPv6 (0x86dd), length 5502: (flowlabel 0x2b831, hlim 58, next-header TCP (6) payload length: 5448) 2001:41b0:fe:8::10.443 > 2001:4878:a225:3000:a00:27ff:feb1:f9b7.52364: Flags [.], cksum 0xdd1d (incorrect -> 0x837c), seq 411617:417033, ack 0, win 391, options [nop,nop,TS val 1310862332 ecr 1533521795], length 5416
1550760470.326279 08:00:27:b1:f9:b7 > 00:10:db:ff:70:02, ethertype IPv6 (0x86dd), length 114: (flowlabel 0xd773a, hlim 64, next-header TCP (6) payload length: 60) 2001:4878:a225:3000:a00:27ff:feb1:f9b7.52364 > 2001:41b0:fe:8::10.443: Flags [.], cksum 0xc811 (incorrect -> 0xdfac), ack 208517, win 19765, options [nop,nop,TS val 1533521833 ecr 1310862317,nop,nop,sack 3 {376413:417033}{369643:375059}{209871:368289}], length 0
1550760470.326311 00:10:db:ff:70:02 > 08:00:27:b1:f9:b7, ethertype IPv6 (0x86dd), length 10918: (flowlabel 0x2b831, hlim 58, next-header TCP (6) payload length: 10864) 2001:41b0:fe:8::10.443 > 2001:4878:a225:3000:a00:27ff:feb1:f9b7.52364: Flags [.], cksum 0xf245 (incorrect -> 0x5f0c), seq 417033:427865, ack 0, win 391, options [nop,nop,TS val 1310862333 ecr 1533521797], length 10832
1550760470.326323 08:00:27:b1:f9:b7 > 00:10:db:ff:70:02, ethertype IPv6 (0x86dd), length 114: (flowlabel 0xd773a, hlim 64, next-header TCP (6) payload length: 60) 2001:4878:a225:3000:a00:27ff:feb1:f9b7.52364 > 2001:41b0:fe:8::10.443: Flags [.], cksum 0xc811 (incorrect -> 0xb55c), ack 208517, win 19765, options [nop,nop,TS val 1533521833 ecr 1310862317,nop,nop,sack 3 {376413:427865}{369643:375059}{209871:368289}], length 0
1550760470.326364 00:10:db:ff:70:02 > 08:00:27:b1:f9:b7, ethertype IPv6 (0x86dd), length 9564: (flowlabel 0x2b831, hlim 58, next-header TCP (6) payload length: 9510) 2001:41b0:fe:8::10.443 > 2001:4878:a225:3000:a00:27ff:feb1:f9b7.52364: Flags [.], cksum 0xecfb (incorrect -> 0x11ea), seq 427865:437343, ack 0, win 391, options [nop,nop,TS val 1310862334 ecr 1533521797], length 9478
1550760470.326376 08:00:27:b1:f9:b7 > 00:10:db:ff:70:02, ethertype IPv6 (0x86dd), length 114: (flowlabel 0xd773a, hlim 64, next-header TCP (6) payload length: 60) 2001:4878:a225:3000:a00:27ff:feb1:f9b7.52364 > 2001:41b0:fe:8::10.443: Flags [.], cksum 0xc811 (incorrect -> 0x9056), ack 208517, win 19765, options [nop,nop,TS val 1533521833 ecr 1310862317,nop,nop,sack 3 {376413:437343}{369643:375059}{209871:368289}], length 0
1550760470.326387 00:10:db:ff:70:02 > 08:00:27:b1:f9:b7, ethertype IPv6 (0x86dd), length 2794: (flowlabel 0x2b831, hlim 58, next-header TCP (6) payload length: 2740) 2001:41b0:fe:8::10.443 > 2001:4878:a225:3000:a00:27ff:feb1:f9b7.52364: Flags [.], cksum 0xd289 (incorrect -> 0xa47a), seq 437343:440051, ack 0, win 391, options [nop,nop,TS val 1310862337 ecr 1533521800], length 2708
1550760470.326392 08:00:27:b1:f9:b7 > 00:10:db:ff:70:02, ethertype IPv6 (0x86dd), length 114: (flowlabel 0xd773a, hlim 64, next-header TCP (6) payload length: 60) 2001:4878:a225:3000:a00:27ff:feb1:f9b7.52364 > 2001:41b0:fe:8::10.443: Flags [.], cksum 0xc811 (incorrect -> 0x85c2), ack 208517, win 19765, options [nop,nop,TS val 1533521833 ecr 1310862317,nop,nop,sack 3 {376413:440051}{369643:375059}{209871:368289}], length 0
1550760470.326418 00:10:db:ff:70:02 > 08:00:27:b1:f9:b7, ethertype IPv6 (0x86dd), length 1440: (flowlabel 0x2b831, hlim 58, next-header TCP (6) payload length: 1386) 2001:41b0:fe:8::10.443 > 2001:4878:a225:3000:a00:27ff:feb1:f9b7.52364: Flags [.], cksum 0xba6a (correct), seq 440051:441405, ack 0, win 391, options [nop,nop,TS val 1310862337 ecr 1533521804], length 1354
1550760470.326426 08:00:27:b1:f9:b7 > 00:10:db:ff:70:02, ethertype IPv6 (0x86dd), length 114: (flowlabel 0xd773a, hlim 64, next-header TCP (6) payload length: 60) 2001:4878:a225:3000:a00:27ff:feb1:f9b7.52364 > 2001:41b0:fe:8::10.443: Flags [.], cksum 0xc811 (incorrect -> 0x8078), ack 208517, win 19765, options [nop,nop,TS val 1533521833 ecr 1310862317,nop,nop,sack 3 {376413:441405}{369643:375059}{209871:368289}], length 0
1550760470.328255 00:10:db:ff:70:02 > 08:00:27:b1:f9:b7, ethertype IPv6 (0x86dd), length 2794: (flowlabel 0x2b831, hlim 58, next-header TCP (6) payload length: 2740) 2001:41b0:fe:8::10.443 > 2001:4878:a225:3000:a00:27ff:feb1:f9b7.52364: Flags [.], cksum 0xd289 (incorrect -> 0xf67c), seq 441405:444113, ack 0, win 391, options [nop,nop,TS val 1310862337 ecr 1533521804], length 2708
1550760470.328286 08:00:27:b1:f9:b7 > 00:10:db:ff:70:02, ethertype IPv6 (0x86dd), length 114: (flowlabel 0xd773a, hlim 64, next-header TCP (6) payload length: 60) 2001:4878:a225:3000:a00:27ff:feb1:f9b7.52364 > 2001:41b0:fe:8::10.443: Flags [.], cksum 0xc811 (incorrect -> 0x75e2), ack 208517, win 19765, options [nop,nop,TS val 1533521835 ecr 1310862317,nop,nop,sack 3 {376413:444113}{369643:375059}{209871:368289}], length 0
1550760470.331060 00:10:db:ff:70:02 > 08:00:27:b1:f9:b7, ethertype IPv6 (0x86dd), length 8210: (flowlabel 0x2b831, hlim 58, next-header TCP (6) payload length: 8156) 2001:41b0:fe:8::10.443 > 2001:4878:a225:3000:a00:27ff:feb1:f9b7.52364: Flags [.], cksum 0xe7b1 (incorrect -> 0x77ff), seq 444113:452237, ack 0, win 391, options [nop,nop,TS val 1310862337 ecr 1533521804], length 8124
1550760470.331102 08:00:27:b1:f9:b7 > 00:10:db:ff:70:02, ethertype IPv6 (0x86dd), length 114: (flowlabel 0xd773a, hlim 64, next-header TCP (6) payload length: 60) 2001:4878:a225:3000:a00:27ff:feb1:f9b7.52364 > 2001:41b0:fe:8::10.443: Flags [.], cksum 0xc811 (incorrect -> 0x5624), ack 208517, win 19765, options [nop,nop,TS val 1533521837 ecr 1310862317,nop,nop,sack 3 {376413:452237}{369643:375059}{209871:368289}], length 0
1550760470.331133 00:10:db:ff:70:02 > 08:00:27:b1:f9:b7, ethertype IPv6 (0x86dd), length 10918: (flowlabel 0x2b831, hlim 58, next-header TCP (6) payload length: 10864) 2001:41b0:fe:8::10.443 > 2001:4878:a225:3000:a00:27ff:feb1:f9b7.52364: Flags [.], cksum 0xf245 (incorrect -> 0x18c7), seq 452237:463069, ack 0, win 391, options [nop,nop,TS val 1310862338 ecr 1533521804], length 10832
1550760470.331146 08:00:27:b1:f9:b7 > 00:10:db:ff:70:02, ethertype IPv6 (0x86dd), length 114: (flowlabel 0xd773a, hlim 64, next-header TCP (6) payload length: 60) 2001:4878:a225:3000:a00:27ff:feb1:f9b7.52364 > 2001:41b0:fe:8::10.443: Flags [.], cksum 0xc811 (incorrect -> 0x2bd3), ack 208517, win 19765, options [nop,nop,TS val 1533521838 ecr 1310862317,nop,nop,sack 3 {376413:463069}{369643:375059}{209871:368289}], length 0
1550760470.331158 00:10:db:ff:70:02 > 08:00:27:b1:f9:b7, ethertype IPv6 (0x86dd), length 1440: (flowlabel 0x2b831, hlim 58, next-header TCP (6) payload length: 1386) 2001:41b0:fe:8::10.443 > 2001:4878:a225:3000:a00:27ff:feb1:f9b7.52364: Flags [.], cksum 0x569c (correct), seq 208517:209871, ack 0, win 391, options [nop,nop,TS val 1310862339 ecr 1533521804], length 1354
1550760470.331204 08:00:27:b1:f9:b7 > 00:10:db:ff:70:02, ethertype IPv6 (0x86dd), length 106: (flowlabel 0xd773a, hlim 64, next-header TCP (6) payload length: 52) 2001:4878:a225:3000:a00:27ff:feb1:f9b7.52364 > 2001:41b0:fe:8::10.443: Flags [.], cksum 0xc809 (incorrect -> 0xe4ed), ack 368289, win 18895, options [nop,nop,TS val 1533521838 ecr 1310862339,nop,nop,sack 2 {376413:463069}{369643:375059}], length 0
1550760470.331259 00:10:db:ff:70:02 > 08:00:27:b1:f9:b7, ethertype IPv6 (0x86dd), length 16334: (flowlabel 0x2b831, hlim 58, next-header TCP (6) payload length: 16280) 2001:41b0:fe:8::10.443 > 2001:4878:a225:3000:a00:27ff:feb1:f9b7.52364: Flags [.], cksum 0x076e (incorrect -> 0xba73), seq 463069:479317, ack 0, win 391, options [nop,nop,TS val 1310862339 ecr 1533521805], length 16248
1550760470.331291 08:00:27:b1:f9:b7 > 00:10:db:ff:70:02, ethertype IPv6 (0x86dd), length 106: (flowlabel 0xd773a, hlim 64, next-header TCP (6) payload length: 52) 2001:4878:a225:3000:a00:27ff:feb1:f9b7.52364 > 2001:41b0:fe:8::10.443: Flags [.], cksum 0xc809 (incorrect -> 0xa575), ack 368289, win 18895, options [nop,nop,TS val 1533521838 ecr 1310862339,nop,nop,sack 2 {376413:479317}{369643:375059}], length 0
1550760470.331344 00:10:db:ff:70:02 > 08:00:27:b1:f9:b7, ethertype IPv6 (0x86dd), length 5502: (flowlabel 0x2b831, hlim 58, next-header TCP (6) payload length: 5448) 2001:41b0:fe:8::10.443 > 2001:4878:a225:3000:a00:27ff:feb1:f9b7.52364: Flags [.], cksum 0xdd1d (incorrect -> 0xc89e), seq 479317:484733, ack 0, win 391, options [nop,nop,TS val 1310862340 ecr 1533521805], length 5416
1550760470.331359 08:00:27:b1:f9:b7 > 00:10:db:ff:70:02, ethertype IPv6 (0x86dd), length 106: (flowlabel 0xd773a, hlim 64, next-header TCP (6) payload length: 52) 2001:4878:a225:3000:a00:27ff:feb1:f9b7.52364 > 2001:41b0:fe:8::10.443: Flags [.], cksum 0xc809 (incorrect -> 0x904d), ack 368289, win 18895, options [nop,nop,TS val 1533521838 ecr 1310862339,nop,nop,sack 2 {376413:484733}{369643:375059}], length 0
1550760470.338148 00:10:db:ff:70:02 > 08:00:27:b1:f9:b7, ethertype IPv6 (0x86dd), length 5502: (flowlabel 0x2b831, hlim 58, next-header TCP (6) payload length: 5448) 2001:41b0:fe:8::10.443 > 2001:4878:a225:3000:a00:27ff:feb1:f9b7.52364: Flags [.], cksum 0xdd1d (incorrect -> 0xfdee), seq 484733:490149, ack 0, win 391, options [nop,nop,TS val 1310862340 ecr 1533521805], length 5416
1550760470.338210 08:00:27:b1:f9:b7 > 00:10:db:ff:70:02, ethertype IPv6 (0x86dd), length 106: (flowlabel 0xd773a, hlim 64, next-header TCP (6) payload length: 52) 2001:4878:a225:3000:a00:27ff:feb1:f9b7.52364 > 2001:41b0:fe:8::10.443: Flags [.], cksum 0xc809 (incorrect -> 0x79f0), ack 368289, win 19197, options [nop,nop,TS val 1533521845 ecr 1310862339,nop,nop,sack 2 {376413:490149}{369643:375059}], length 0
1550760470.339908 00:10:db:ff:70:02 > 08:00:27:b1:f9:b7, ethertype IPv6 (0x86dd), length 9564: (flowlabel 0x2b831, hlim 58, next-header TCP (6) payload length: 9510) 2001:41b0:fe:8::10.443 > 2001:4878:a225:3000:a00:27ff:feb1:f9b7.52364: Flags [.], cksum 0xecfb (incorrect -> 0xa1a1), seq 490149:499627, ack 0, win 391, options [nop,nop,TS val 1310862341 ecr 1533521805], length 9478
1550760470.339933 08:00:27:b1:f9:b7 > 00:10:db:ff:70:02, ethertype IPv6 (0x86dd), length 106: (flowlabel 0xd773a, hlim 64, next-header TCP (6) payload length: 52) 2001:4878:a225:3000:a00:27ff:feb1:f9b7.52364 > 2001:41b0:fe:8::10.443: Flags [.], cksum 0xc809 (incorrect -> 0x5367), ack 368289, win 19583, options [nop,nop,TS val 1533521846 ecr 1310862339,nop,nop,sack 2 {376413:499627}{369643:375059}], length 0
1550760470.339956 00:10:db:ff:70:02 > 08:00:27:b1:f9:b7, ethertype IPv6 (0x86dd), length 10918: (flowlabel 0x2b831, hlim 58, next-header TCP (6) payload length: 10864) 2001:41b0:fe:8::10.443 > 2001:4878:a225:3000:a00:27ff:feb1:f9b7.52364: Flags [.], cksum 0xf245 (incorrect -> 0x8857), seq 499627:510459, ack 0, win 391, options [nop,nop,TS val 1310862342 ecr 1533521805], length 10832
1550760470.339966 08:00:27:b1:f9:b7 > 00:10:db:ff:70:02, ethertype IPv6 (0x86dd), length 106: (flowlabel 0xd773a, hlim 64, next-header TCP (6) payload length: 52) 2001:4878:a225:3000:a00:27ff:feb1:f9b7.52364 > 2001:41b0:fe:8::10.443: Flags [.], cksum 0xc809 (incorrect -> 0x2917), ack 368289, win 19583, options [nop,nop,TS val 1533521846 ecr 1310862339,nop,nop,sack 2 {376413:510459}{369643:375059}], length 0
1550760470.340024 00:10:db:ff:70:02 > 08:00:27:b1:f9:b7, ethertype IPv6 (0x86dd), length 8210: (flowlabel 0x2b831, hlim 58, next-header TCP (6) payload length: 8156) 2001:41b0:fe:8::10.443 > 2001:4878:a225:3000:a00:27ff:feb1:f9b7.52364: Flags [.], cksum 0xe7b1 (incorrect -> 0xc9b3), seq 510459:518583, ack 0, win 391, options [nop,nop,TS val 1310862343 ecr 1533521805], length 8124
1550760470.340035 08:00:27:b1:f9:b7 > 00:10:db:ff:70:02, ethertype IPv6 (0x86dd), length 106: (flowlabel 0xd773a, hlim 64, next-header TCP (6) payload length: 52) 2001:4878:a225:3000:a00:27ff:feb1:f9b7.52364 > 2001:41b0:fe:8::10.443: Flags [.], cksum 0xc809 (incorrect -> 0x095b), ack 368289, win 19583, options [nop,nop,TS val 1533521846 ecr 1310862339,nop,nop,sack 2 {376413:518583}{369643:375059}], length 0
1550760470.345305 00:10:db:ff:70:02 > 08:00:27:b1:f9:b7, ethertype IPv6 (0x86dd), length 4148: (flowlabel 0x2b831, hlim 58, next-header TCP (6) payload length: 4094) 2001:41b0:fe:8::10.443 > 2001:4878:a225:3000:a00:27ff:feb1:f9b7.52364: Flags [.], cksum 0xd7d3 (incorrect -> 0xfe04), seq 518583:522645, ack 0, win 391, options [nop,nop,TS val 1310862347 ecr 1533521810], length 4062
1550760470.345363 08:00:27:b1:f9:b7 > 00:10:db:ff:70:02, ethertype IPv6 (0x86dd), length 106: (flowlabel 0xd773a, hlim 64, next-header TCP (6) payload length: 52) 2001:4878:a225:3000:a00:27ff:feb1:f9b7.52364 > 2001:41b0:fe:8::10.443: Flags [.], cksum 0xc809 (incorrect -> 0xf976), ack 368289, win 19583, options [nop,nop,TS val 1533521852 ecr 1310862339,nop,nop,sack 2 {376413:522645}{369643:375059}], length 0
1550760470.345399 00:10:db:ff:70:02 > 08:00:27:b1:f9:b7, ethertype IPv6 (0x86dd), length 8210: (flowlabel 0x2b831, hlim 58, next-header TCP (6) payload length: 8156) 2001:41b0:fe:8::10.443 > 2001:4878:a225:3000:a00:27ff:feb1:f9b7.52364: Flags [.], cksum 0xe7b1 (incorrect -> 0x7ffe), seq 522645:530769, ack 0, win 391, options [nop,nop,TS val 1310862347 ecr 1533521813], length 8124
1550760470.345411 08:00:27:b1:f9:b7 > 00:10:db:ff:70:02, ethertype IPv6 (0x86dd), length 106: (flowlabel 0xd773a, hlim 64, next-header TCP (6) payload length: 52) 2001:4878:a225:3000:a00:27ff:feb1:f9b7.52364 > 2001:41b0:fe:8::10.443: Flags [.], cksum 0xc809 (incorrect -> 0xd9ba), ack 368289, win 19583, options [nop,nop,TS val 1533521852 ecr 1310862339,nop,nop,sack 2 {376413:530769}{369643:375059}], length 0
1550760470.345430 00:10:db:ff:70:02 > 08:00:27:b1:f9:b7, ethertype IPv6 (0x86dd), length 8210: (flowlabel 0x2b831, hlim 58, next-header TCP (6) payload length: 8156) 2001:41b0:fe:8::10.443 > 2001:4878:a225:3000:a00:27ff:feb1:f9b7.52364: Flags [.], cksum 0xe7b1 (incorrect -> 0xed66), seq 530769:538893, ack 0, win 391, options [nop,nop,TS val 1310862348 ecr 1533521813], length 8124
