1550760520.357572 08:00:27:b1:f9:b7 > 00:10:db:ff:70:02, ethertype IPv6 (0x86dd), length 114: (flowlabel 0xd773a, hlim 64, next-header TCP (6) payload length: 60) 2001:4878:a225:3000:a00:27ff:feb1:f9b7.52364 > 2001:41b0:fe:8::10.443: Flags [.], cksum 0xc811 (incorrect -> 0xa2e0), ack 2192805990, win 20227, options [nop,nop,TS val 1533571839 ecr 1310912280,nop,nop,sack 3 {109675:192269}{32497:106967}{2709:31143}], length 0
1550760520.359954 00:10:db:ff:70:02 > 08:00:27:b1:f9:b7, ethertype IPv6 (0x86dd), length 4148: (flowlabel 0x2b831, hlim 58, next-header TCP (6) payload length: 4094) 2001:41b0:fe:8::10.443 > 2001:4878:a225:3000:a00:27ff:feb1:f9b7.52364: Flags [.], cksum 0xd7d3 (incorrect -> 0x4706), seq 192269:196331, ack 0, win 448, options [nop,nop,TS val 1310912304 ecr 1533571741], length 4062
1550760520.360029 08:00:27:b1:f9:b7 > 00:10:db:ff:70:02, ethertype IPv6 (0x86dd), length 114: (flowlabel 0xd773a, hlim 64, next-header TCP (6) payload length: 60) 2001:4878:a225:3000:a00:27ff:feb1:f9b7.52364 > 2001:41b0:fe:8::10.443: Flags [.], cksum 0xc811 (incorrect -> 0x9300), ack 1, win 20227, options [nop,nop,TS val 1533571841 ecr 1310912280,nop,nop,sack 3 {109675:196331}{32497:106967}{2709:31143}], length 0
1550760520.360077 00:10:db:ff:70:02 > 08:00:27:b1:f9:b7, ethertype IPv6 (0x86dd), length 6856: (flowlabel 0x2b831, hlim 58, next-header TCP (6) payload length: 6802) 2001:41b0:fe:8::10.443 > 2001:4878:a225:3000:a00:27ff:feb1:f9b7.52364: Flags [.], cksum 0xe267 (incorrect -> 0x36a0), seq 196331:203101, ack 0, win 448, options [nop,nop,TS val 1310912305 ecr 1533571741], length 6770
1550760520.360099 08:00:27:b1:f9:b7 > 00:10:db:ff:70:02, ethertype IPv6 (0x86dd), length 114: (flowlabel 0xd773a, hlim 64, next-header TCP (6) payload length: 60) 2001:4878:a225:3000:a00:27ff:feb1:f9b7.52364 > 2001:41b0:fe:8::10.443: Flags [.], cksum 0xc811 (incorrect -> 0x788e), ack 1, win 20227, options [nop,nop,TS val 1533571841 ecr 1310912280,nop,nop,sack 3 {109675:203101}{32497:106967}{2709:31143}], length 0
1550760520.360124 00:10:db:ff:70:02 > 08:00:27:b1:f9:b7, ethertype IPv6 (0x86dd), length 6856: (flowlabel 0x2b831, hlim 58, next-header TCP (6) payload length: 6802) 2001:41b0:fe:8::10.443 > 2001:4878:a225:3000:a00:27ff:feb1:f9b7.52364: Flags [.], cksum 0xe267 (incorrect -> 0xbfa8), seq 203101:209871, ack 0, win 448, options [nop,nop,TS val 1310912306 ecr 1533571741], length 6770
1550760520.360140 08:00:27:b1:f9:b7 > 00:10:db:ff:70:02, ethertype IPv6 (0x86dd), length 114: (flowlabel 0xd773a, hlim 64, next-header TCP (6) payload length: 60) 2001:4878:a225:3000:a00:27ff:feb1:f9b7.52364 > 2001:41b0:fe:8::10.443: Flags [.], cksum 0xc811 (incorrect -> 0x5e1b), ack 1, win 20227, options [nop,nop,TS val 1533571842 ecr 1310912280,nop,nop,sack 3 {109675:209871}{32497:106967}{2709:31143}], length 0
1550760520.360213 00:10:db:ff:70:02 > 08:00:27:b1:f9:b7, ethertype IPv6 (0x86dd), length 10918: (flowlabel 0x2b831, hlim 58, next-header TCP (6) payload length: 10864) 2001:41b0:fe:8::10.443 > 2001:4878:a225:3000:a00:27ff:feb1:f9b7.52364: Flags [.], cksum 0xf245 (incorrect -> 0x80db), seq 209871:220703, ack 0, win 448, options [nop,nop,TS val 1310912307 ecr 1533571741], length 10832
1550760520.360245 08:00:27:b1:f9:b7 > 00:10:db:ff:70:02, ethertype IPv6 (0x86dd), length 114: (flowlabel 0xd773a, hlim 64, next-header TCP (6) payload length: 60) 2001:4878:a225:3000:a00:27ff:feb1:f9b7.52364 > 2001:41b0:fe:8::10.443: Flags [.], cksum 0xc811 (incorrect -> 0x33cb), ack 1, win 20227, options [nop,nop,TS val 1533571842 ecr 1310912280,nop,nop,sack 3 {109675:220703}{32497:106967}{2709:31143}], length 0
1550760520.360289 00:10:db:ff:70:02 > 08:00:27:b1:f9:b7, ethertype IPv6 (0x86dd), length 1440: (flowlabel 0x2b831, hlim 58, next-header TCP (6) payload length: 1386) 2001:41b0:fe:8::10.443 > 2001:4878:a225:3000:a00:27ff:feb1:f9b7.52364: Flags [.], cksum 0xf4e1 (correct), seq 220703:222057, ack 0, win 448, options [nop,nop,TS val 1310912308 ecr 1533571741], length 1354
1550760520.360302 08:00:27:b1:f9:b7 > 00:10:db:ff:70:02, ethertype IPv6 (0x86dd), length 114: (flowlabel 0xd773a, hlim 64, next-header TCP (6) payload length: 60) 2001:4878:a225:3000:a00:27ff:feb1:f9b7.52364 > 2001:41b0:fe:8::10.443: Flags [.], cksum 0xc811 (incorrect -> 0x2e81), ack 1, win 20227, options [nop,nop,TS val 1533571842 ecr 1310912280,nop,nop,sack 3 {109675:222057}{32497:106967}{2709:31143}], length 0
1550760520.374368 00:10:db:ff:70:02 > 08:00:27:b1:f9:b7, ethertype IPv6 (0x86dd), length 5502: (flowlabel 0x2b831, hlim 58, next-header TCP (6) payload length: 5448) 2001:41b0:fe:8::10.443 > 2001:4878:a225:3000:a00:27ff:feb1:f9b7.52364: Flags [.], cksum 0xdd1d (incorrect -> 0xb89b), seq 222057:227473, ack 0, win 448, options [nop,nop,TS val 1310912308 ecr 1533571741], length 5416
1550760520.374399 08:00:27:b1:f9:b7 > 00:10:db:ff:70:02, ethertype IPv6 (0x86dd), length 114: (flowlabel 0xd773a, hlim 64, next-header TCP (6) payload length: 60) 2001:4878:a225:3000:a00:27ff:feb1:f9b7.52364 > 2001:41b0:fe:8::10.443: Flags [.], cksum 0xc811 (incorrect -> 0x194b), ack 1, win 20227, options [nop,nop,TS val 1533571856 ecr 1310912280,nop,nop,sack 3 {109675:227473}{32497:106967}{2709:31143}], length 0
1550760520.374469 00:10:db:ff:70:02 > 08:00:27:b1:f9:b7, ethertype IPv6 (0x86dd), length 4148: (flowlabel 0x2b831, hlim 58, next-header TCP (6) payload length: 4094) 2001:41b0:fe:8::10.443 > 2001:4878:a225:3000:a00:27ff:feb1:f9b7.52364: Flags [.], cksum 0xd7d3 (incorrect -> 0xe52f), seq 227473:231535, ack 0, win 448, options [nop,nop,TS val 1310912309 ecr 1533571741], length 4062
1550760520.374516 08:00:27:b1:f9:b7 > 00:10:db:ff:70:02, ethertype IPv6 (0x86dd), length 114: (flowlabel 0xd773a, hlim 64, next-header TCP (6) payload length: 60) 2001:4878:a225:3000:a00:27ff:feb1:f9b7.52364 > 2001:41b0:fe:8::10.443: Flags [.], cksum 0xc811 (incorrect -> 0x096d), ack 1, win 20227, options [nop,nop,TS val 1533571856 ecr 1310912280,nop,nop,sack 3 {109675:231535}{32497:106967}{2709:31143}], length 0
1550760520.376023 00:10:db:ff:70:02 > 08:00:27:b1:f9:b7, ethertype IPv6 (0x86dd), length 2794: (flowlabel 0x2b831, hlim 58, next-header TCP (6) payload length: 2740) 2001:41b0:fe:8::10.443 > 2001:4878:a225:3000:a00:27ff:feb1:f9b7.52364: Flags [.], cksum 0xd289 (incorrect -> 0x9de5), seq 231535:234243, ack 0, win 448, options [nop,nop,TS val 1310912309 ecr 1533571741], length 2708
1550760520.376048 08:00:27:b1:f9:b7 > 00:10:db:ff:70:02, ethertype IPv6 (0x86dd), length 114: (flowlabel 0xd773a, hlim 64, next-header TCP (6) payload length: 60) 2001:4878:a225:3000:a00:27ff:feb1:f9b7.52364 > 2001:41b0:fe:8::10.443: Flags [.], cksum 0xc811 (incorrect -> 0xfed7), ack 1, win 20227, options [nop,nop,TS val 1533571857 ecr 1310912280,nop,nop,sack 3 {109675:234243}{32497:106967}{2709:31143}], length 0
1550760520.376069 00:10:db:ff:70:02 > 08:00:27:b1:f9:b7, ethertype IPv6 (0x86dd), length 6856: (flowlabel 0x2b831, hlim 58, next-header TCP (6) payload length: 6802) 2001:41b0:fe:8::10.443 > 2001:4878:a225:3000:a00:27ff:feb1:f9b7.52364: Flags [.], cksum 0xe267 (incorrect -> 0x564d), seq 234243:241013, ack 0, win 448, options [nop,nop,TS val 1310912310 ecr 1533571741], length 6770
1550760520.376078 08:00:27:b1:f9:b7 > 00:10:db:ff:70:02, ethertype IPv6 (0x86dd), length 114: (flowlabel 0xd773a, hlim 64, next-header TCP (6) payload length: 60) 2001:4878:a225:3000:a00:27ff:feb1:f9b7.52364 > 2001:41b0:fe:8::10.443: Flags [.], cksum 0xc811 (incorrect -> 0xe465), ack 1, win 20227, options [nop,nop,TS val 1533571857 ecr 1310912280,nop,nop,sack 3 {109675:241013}{32497:106967}{2709:31143}], length 0
1550760520.376093 00:10:db:ff:70:02 > 08:00:27:b1:f9:b7, ethertype IPv6 (0x86dd), length 10918: (flowlabel 0x2b831, hlim 58, next-header TCP (6) payload length: 10864) 2001:41b0:fe:8::10.443 > 2001:4878:a225:3000:a00:27ff:feb1:f9b7.52364: Flags [.], cksum 0xf245 (incorrect -> 0x911a), seq 241013:251845, ack 0, win 448, options [nop,nop,TS val 1310912311 ecr 1533571741], length 10832
1550760520.376102 08:00:27:b1:f9:b7 > 00:10:db:ff:70:02, ethertype IPv6 (0x86dd), length 114: (flowlabel 0xd773a, hlim 64, next-header TCP (6) payload length: 60) 2001:4878:a225:3000:a00:27ff:feb1:f9b7.52364 > 2001:41b0:fe:8::10.443: Flags [.], cksum 0xc811 (incorrect -> 0xba15), ack 1, win 20227, options [nop,nop,TS val 1533571857 ecr 1310912280,nop,nop,sack 3 {109675:251845}{32497:106967}{2709:31143}], length 0
1550760520.376157 00:10:db:ff:70:02 > 08:00:27:b1:f9:b7, ethertype IPv6 (0x86dd), length 4148: (flowlabel 0x2b831, hlim 58, next-header TCP (6) payload length: 4094) 2001:41b0:fe:8::10.443 > 2001:4878:a225:3000:a00:27ff:feb1:f9b7.52364: Flags [.], cksum 0xd7d3 (incorrect -> 0x9ab2), seq 251845:255907, ack 0, win 448, options [nop,nop,TS val 1310912312 ecr 1533571741], length 4062
1550760520.376168 08:00:27:b1:f9:b7 > 00:10:db:ff:70:02, ethertype IPv6 (0x86dd), length 114: (flowlabel 0xd773a, hlim 64, next-header TCP (6) payload length: 60) 2001:4878:a225:3000:a00:27ff:feb1:f9b7.52364 > 2001:41b0:fe:8::10.443: Flags [.], cksum 0xc811 (incorrect -> 0xaa36), ack 1, win 20227, options [nop,nop,TS val 1533571858 ecr 1310912280,nop,nop,sack 3 {109675:255907}{32497:106967}{2709:31143}], length 0
1550760520.377796 00:10:db:ff:70:02 > 08:00:27:b1:f9:b7, ethertype IPv6 (0x86dd), length 2794: (flowlabel 0x2b831, hlim 58, next-header TCP (6) payload length: 2740) 2001:41b0:fe:8::10.443 > 2001:4878:a225:3000:a00:27ff:feb1:f9b7.52364: Flags [.], cksum 0xd289 (incorrect -> 0x5fcd), seq 255907:258615, ack 0, win 448, options [nop,nop,TS val 1310912312 ecr 1533571741], length 2708
1550760520.377811 08:00:27:b1:f9:b7 > 00:10:db:ff:70:02, ethertype IPv6 (0x86dd), length 114: (flowlabel 0xd773a, hlim 64, next-header TCP (6) payload length: 60) 2001:4878:a225:3000:a00:27ff:feb1:f9b7.52364 > 2001:41b0:fe:8::10.443: Flags [.], cksum 0xc811 (incorrect -> 0x9fa1), ack 1, win 20227, options [nop,nop,TS val 1533571859 ecr 1310912280,nop,nop,sack 3 {109675:258615}{32497:106967}{2709:31143}], length 0
1550760520.377869 00:10:db:ff:70:02 > 08:00:27:b1:f9:b7, ethertype IPv6 (0x86dd), length 6856: (flowlabel 0x2b831, hlim 58, next-header TCP (6) payload length: 6802) 2001:41b0:fe:8::10.443 > 2001:4878:a225:3000:a00:27ff:feb1:f9b7.52364: Flags [.], cksum 0xe267 (incorrect -> 0x5688), seq 258615:265385, ack 0, win 448, options [nop,nop,TS val 1310912313 ecr 1533571741], length 6770
1550760520.377882 08:00:27:b1:f9:b7 > 00:10:db:ff:70:02, ethertype IPv6 (0x86dd), length 114: (flowlabel 0xd773a, hlim 64, next-header TCP (6) payload length: 60) 2001:4878:a225:3000:a00:27ff:feb1:f9b7.52364 > 2001:41b0:fe:8::10.443: Flags [.], cksum 0xc811 (incorrect -> 0x852f), ack 1, win 20227, options [nop,nop,TS val 1533571859 ecr 1310912280,nop,nop,sack 3 {109675:265385}{32497:106967}{2709:31143}], length 0
1550760520.377945 00:10:db:ff:70:02 > 08:00:27:b1:f9:b7, ethertype IPv6 (0x86dd), length 6856: (flowlabel 0x2b831, hlim 58, next-header TCP (6) payload length: 6802) 2001:41b0:fe:8::10.443 > 2001:4878:a225:3000:a00:27ff:feb1:f9b7.52364: Flags [.], cksum 0xe267 (incorrect -> 0x667f), seq 265385:272155, ack 0, win 448, options [nop,nop,TS val 1310912314 ecr 1533571741], length 6770
1550760520.377961 08:00:27:b1:f9:b7 > 00:10:db:ff:70:02, ethertype IPv6 (0x86dd), length 114: (flowlabel 0xd773a, hlim 64, next-header TCP (6) payload length: 60) 2001:4878:a225:3000:a00:27ff:feb1:f9b7.52364 > 2001:41b0:fe:8::10.443: Flags [.], cksum 0xc811 (incorrect -> 0x6abd), ack 1, win 20227, options [nop,nop,TS val 1533571859 ecr 1310912280,nop,nop,sack 3 {109675:272155}{32497:106967}{2709:31143}], length 0
1550760520.378013 00:10:db:ff:70:02 > 08:00:27:b1:f9:b7, ethertype IPv6 (0x86dd), length 10918: (flowlabel 0x2b831, hlim 58, next-header TCP (6) payload length: 10864) 2001:41b0:fe:8::10.443 > 2001:4878:a225:3000:a00:27ff:feb1:f9b7.52364: Flags [.], cksum 0xf245 (incorrect -> 0xe003), seq 272155:282987, ack 0, win 448, options [nop,nop,TS val 1310912315 ecr 1533571741], length 10832
1550760520.378026 08:00:27:b1:f9:b7 > 00:10:db:ff:70:02, ethertype IPv6 (0x86dd), length 114: (flowlabel 0xd773a, hlim 64, next-header TCP (6) payload length: 60) 2001:4878:a225:3000:a00:27ff:feb1:f9b7.52364 > 2001:41b0:fe:8::10.443: Flags [.], cksum 0xc811 (incorrect -> 0x406d), ack 1, win 20227, options [nop,nop,TS val 1533571859 ecr 1310912280,nop,nop,sack 3 {109675:282987}{32497:106967}{2709:31143}], length 0
1550760520.378058 00:10:db:ff:70:02 > 08:00:27:b1:f9:b7, ethertype IPv6 (0x86dd), length 1440: (flowlabel 0x2b831, hlim 58, next-header TCP (6) payload length: 1386) 2001:41b0:fe:8::10.443 > 2001:4878:a225:3000:a00:27ff:feb1:f9b7.52364: Flags [.], cksum 0x8e4f (correct), seq 282987:284341, ack 0, win 448, options [nop,nop,TS val 1310912316 ecr 1533571741], length 1354
1550760520.378066 08:00:27:b1:f9:b7 > 00:10:db:ff:70:02, ethertype IPv6 (0x86dd), length 114: (flowlabel 0xd773a, hlim 64, next-header TCP (6) payload length: 60) 2001:4878:a225:3000:a00:27ff:feb1:f9b7.52364 > 2001:41b0:fe:8::10.443: Flags [.], cksum 0xc811 (incorrect -> 0x3b23), ack 1, win 20227, options [nop,nop,TS val 1533571859 ecr 1310912280,nop,nop,sack 3 {109675:284341}{32497:106967}{2709:31143}], length 0
1550760520.379102 00:10:db:ff:70:02 > 08:00:27:b1:f9:b7, ethertype IPv6 (0x86dd), length 5502: (flowlabel 0x2b831, hlim 58, next-header TCP (6) payload length: 5448) 2001:41b0:fe:8::10.443 > 2001:4878:a225:3000:a00:27ff:feb1:f9b7.52364: Flags [.], cksum 0xdd1d (incorrect -> 0x3356), seq 284341:289757, ack 0, win 448, options [nop,nop,TS val 1310912316 ecr 1533571741], length 5416
1550760520.379113 08:00:27:b1:f9:b7 > 00:10:db:ff:70:02, ethertype IPv6 (0x86dd), length 114: (flowlabel 0xd773a, hlim 64, next-header TCP (6) payload length: 60) 2001:4878:a225:3000:a00:27ff:feb1:f9b7.52364 > 2001:41b0:fe:8::10.443: Flags [.], cksum 0xc811 (incorrect -> 0x25fa), ack 1, win 20227, options [nop,nop,TS val 1533571860 ecr 1310912280,nop,nop,sack 3 {109675:289757}{32497:106967}{2709:31143}], length 0
1550760520.379127 00:10:db:ff:70:02 > 08:00:27:b1:f9:b7, ethertype IPv6 (0x86dd), length 6856: (flowlabel 0x2b831, hlim 58, next-header TCP (6) payload length: 6802) 2001:41b0:fe:8::10.443 > 2001:4878:a225:3000:a00:27ff:feb1:f9b7.52364: Flags [.], cksum 0xe267 (incorrect -> 0x3e28), seq 289757:296527, ack 0, win 448, options [nop,nop,TS val 1310912317 ecr 1533571741], length 6770
1550760520.379132 08:00:27:b1:f9:b7 > 00:10:db:ff:70:02, ethertype IPv6 (0x86dd), length 114: (flowlabel 0xd773a, hlim 64, next-header TCP (6) payload length: 60) 2001:4878:a225:3000:a00:27ff:feb1:f9b7.52364 > 2001:41b0:fe:8::10.443: Flags [.], cksum 0xc811 (incorrect -> 0x0b87), ack 1, win 20227, options [nop,nop,TS val 1533571861 ecr 1310912280,nop,nop,sack 3 {109675:296527}{32497:106967}{2709:31143}], length 0
1550760520.379159 00:10:db:ff:70:02 > 08:00:27:b1:f9:b7, ethertype IPv6 (0x86dd), length 6856: (flowlabel 0x2b831, hlim 58, next-header TCP (6) payload length: 6802) 2001:41b0:fe:8::10.443 > 2001:4878:a225:3000:a00:27ff:feb1:f9b7.52364: Flags [.], cksum 0xe267 (incorrect -> 0xbf2c), seq 296527:303297, ack 0, win 448, options [nop,nop,TS val 1310912318 ecr 1533571741], length 6770
1550760520.379167 08:00:27:b1:f9:b7 > 00:10:db:ff:70:02, ethertype IPv6 (0x86dd), length 114: (flowlabel 0xd773a, hlim 64, next-header TCP (6) payload length: 60) 2001:4878:a225:3000:a00:27ff:feb1:f9b7.52364 > 2001:41b0:fe:8::10.443: Flags [.], cksum 0xc811 (incorrect -> 0xf114), ack 1, win 20227, options [nop,nop,TS val 1533571861 ecr 1310912280,nop,nop,sack 3 {109675:303297}{32497:106967}{2709:31143}], length 0
1550760520.394592 00:10:db:ff:70:02 > 08:00:27:b1:f9:b7, ethertype IPv6 (0x86dd), length 2794: (flowlabel 0x2b831, hlim 58, next-header TCP (6) payload length: 2740) 2001:41b0:fe:8::10.443 > 2001:4878:a225:3000:a00:27ff:feb1:f9b7.52364: Flags [.], cksum 0xd289 (incorrect -> 0x7cb0), seq 303297:306005, ack 0, win 448, options [nop,nop,TS val 1310912319 ecr 1533571741], length 2708
1550760520.394626 08:00:27:b1:f9:b7 > 00:10:db:ff:70:02, ethertype IPv6 (0x86dd), length 114: (flowlabel 0xd773a, hlim 64, next-header TCP (6) payload length: 60) 2001:4878:a225:3000:a00:27ff:feb1:f9b7.52364 > 2001:41b0:fe:8::10.443: Flags [.], cksum 0xc811 (incorrect -> 0xe671), ack 1, win 20227, options [nop,nop,TS val 1533571876 ecr 1310912280,nop,nop,sack 3 {109675:306005}{32497:106967}{2709:31143}], length 0
1550760520.396245 00:10:db:ff:70:02 > 08:00:27:b1:f9:b7, ethertype IPv6 (0x86dd), length 8210: (flowlabel 0x2b831, hlim 58, next-header TCP (6) payload length: 8156) 2001:41b0:fe:8::10.443 > 2001:4878:a225:3000:a00:27ff:feb1:f9b7.52364: Flags [.], cksum 0xe7b1 (incorrect -> 0x9774), seq 306005:314129, ack 0, win 448, options [nop,nop,TS val 1310912319 ecr 1533571741], length 8124
1550760520.396273 08:00:27:b1:f9:b7 > 00:10:db:ff:70:02, ethertype IPv6 (0x86dd), length 114: (flowlabel 0xd773a, hlim 64, next-header TCP (6) payload length: 60) 2001:4878:a225:3000:a00:27ff:feb1:f9b7.52364 > 2001:41b0:fe:8::10.443: Flags [.], cksum 0xc811 (incorrect -> 0xc6b3), ack 1, win 20227, options [nop,nop,TS val 1533571878 ecr 1310912280,nop,nop,sack 3 {109675:314129}{32497:106967}{2709:31143}], length 0
1550760520.396296 00:10:db:ff:70:02 > 08:00:27:b1:f9:b7, ethertype IPv6 (0x86dd), length 6856: (flowlabel 0x2b831, hlim 58, next-header TCP (6) payload length: 6802) 2001:41b0:fe:8::10.443 > 2001:4878:a225:3000:a00:27ff:feb1:f9b7.52364: Flags [.], cksum 0xe267 (incorrect -> 0xa8e6), seq 314129:320899, ack 0, win 448, options [nop,nop,TS val 1310912320 ecr 1533571741], length 6770
1550760520.396303 08:00:27:b1:f9:b7 > 00:10:db:ff:70:02, ethertype IPv6 (0x86dd), length 114: (flowlabel 0xd773a, hlim 64, next-header TCP (6) payload length: 60) 2001:4878:a225:3000:a00:27ff:feb1:f9b7.52364 > 2001:41b0:fe:8::10.443: Flags [.], cksum 0xc811 (incorrect -> 0xac41), ack 1, win 20227, options [nop,nop,TS val 1533571878 ecr 1310912280,nop,nop,sack 3 {109675:320899}{32497:106967}{2709:31143}], length 0
1550760520.396335 00:10:db:ff:70:02 > 08:00:27:b1:f9:b7, ethertype IPv6 (0x86dd), length 6856: (flowlabel 0x2b831, hlim 58, next-header TCP (6) payload length: 6802) 2001:41b0:fe:8::10.443 > 2001:4878:a225:3000:a00:27ff:feb1:f9b7.52364: Flags [.], cksum 0xe267 (incorrect -> 0xcaa6), seq 320899:327669, ack 0, win 448, options [nop,nop,TS val 1310912321 ecr 1533571741], length 6770
1550760520.396345 08:00:27:b1:f9:b7 > 00:10:db:ff:70:02, ethertype IPv6 (0x86dd), length 114: (flowlabel 0xd773a, hlim 64, next-header TCP (6) payload length: 60) 2001:4878:a225:3000:a00:27ff:feb1:f9b7.52364 > 2001:41b0:fe:8::10.443: Flags [.], cksum 0xc811 (incorrect -> 0x91cf), ack 1, win 20227, options [nop,nop,TS val 1533571878 ecr 1310912280,nop,nop,sack 3 {109675:327669}{32497:106967}{2709:31143}], length 0
1550760520.396355 00:10:db:ff:70:02 > 08:00:27:b1:f9:b7, ethertype IPv6 (0x86dd), length 6856: (flowlabel 0x2b831, hlim 58, next-header TCP (6) payload length: 6802) 2001:41b0:fe:8::10.443 > 2001:4878:a225:3000:a00:27ff:feb1:f9b7.52364: Flags [.], cksum 0xe267 (incorrect -> 0x0ae9), seq 327669:334439, ack 0, win 448, options [nop,nop,TS val 1310912322 ecr 1533571741], length 6770
1550760520.396360 08:00:27:b1:f9:b7 > 00:10:db:ff:70:02, ethertype IPv6 (0x86dd), length 114: (flowlabel 0xd773a, hlim 64, next-header TCP (6) payload length: 60) 2001:4878:a225:3000:a00:27ff:feb1:f9b7.52364 > 2001:41b0:fe:8::10.443: Flags [.], cksum 0xc811 (incorrect -> 0x775d), ack 1, win 20227, options [nop,nop,TS val 1533571878 ecr 1310912280,nop,nop,sack 3 {109675:334439}{32497:106967}{2709:31143}], length 0
1550760520.396383 00:10:db:ff:70:02 > 08:00:27:b1:f9:b7, ethertype IPv6 (0x86dd), length 1440: (flowlabel 0x2b831, hlim 58, next-header TCP (6) payload length: 1386) 2001:41b0:fe:8::10.443 > 2001:4878:a225:3000:a00:27ff:feb1:f9b7.52364: Flags [.], cksum 0x16b7 (correct), seq 334439:335793, ack 0, win 448, options [nop,nop,TS val 1310912323 ecr 1533571741], length 1354
1550760520.396389 08:00:27:b1:f9:b7 > 00:10:db:ff:70:02, ethertype IPv6 (0x86dd), length 114: (flowlabel 0xd773a, hlim 64, next-header TCP (6) payload length: 60) 2001:4878:a225:3000:a00:27ff:feb1:f9b7.52364 > 2001:41b0:fe:8::10.443: Flags [.], cksum 0xc811 (incorrect -> 0x7213), ack 1, win 20227, options [nop,nop,TS val 1533571878 ecr 1310912280,nop,nop,sack 3 {109675:335793}{32497:106967}{2709:31143}], length 0
1550760520.398123 00:10:db:ff:70:02 > 08:00:27:b1:f9:b7, ethertype IPv6 (0x86dd), length 9564: (flowlabel 0x2b831, hlim 58, next-header TCP (6) payload length: 9510) 2001:41b0:fe:8::10.443 > 2001:4878:a225:3000:a00:27ff:feb1:f9b7.52364: Flags [.], cksum 0xecfb (incorrect -> 0x719d), seq 335793:345271, ack 0, win 448, options [nop,nop,TS val 1310912323 ecr 1533571741], length 9478
1550760520.398145 08:00:27:b1:f9:b7 > 00:10:db:ff:70:02, ethertype IPv6 (0x86dd), length 114: (flowlabel 0xd773a, hlim 64, next-header TCP (6) payload length: 60) 2001:4878:a225:3000:a00:27ff:feb1:f9b7.52364 > 2001:41b0:fe:8::10.443: Flags [.], cksum 0xc811 (incorrect -> 0x4d0b), ack 1, win 20227, options [nop,nop,TS val 1533571880 ecr 1310912280,nop,nop,sack 3 {109675:345271}{32497:106967}{2709:31143}], length 0
1550760520.398168 00:10:db:ff:70:02 > 08:00:27:b1:f9:b7, ethertype IPv6 (0x86dd), length 6856: (flowlabel 0x2b831, hlim 58, next-header TCP (6) payload length: 6802) 2001:41b0:fe:8::10.443 > 2001:4878:a225:3000:a00:27ff:feb1:f9b7.52364: Flags [.], cksum 0xe267 (incorrect -> 0xea20), seq 345271:352041, ack 0, win 448, options [nop,nop,TS val 1310912324 ecr 1533571741], length 6770
1550760520.398177 08:00:27:b1:f9:b7 > 00:10:db:ff:70:02, ethertype IPv6 (0x86dd), length 114: (flowlabel 0xd773a, hlim 64, next-header TCP (6) payload length: 60) 2001:4878:a225:3000:a00:27ff:feb1:f9b7.52364 > 2001:41b0:fe:8::10.443: Flags [.], cksum 0xc811 (incorrect -> 0x3299), ack 1, win 20227, options [nop,nop,TS val 1533571880 ecr 1310912280,nop,nop,sack 3 {109675:352041}{32497:106967}{2709:31143}], length 0
1550760520.398217 00:10:db:ff:70:02 > 08:00:27:b1:f9:b7, ethertype IPv6 (0x86dd), length 6856: (flowlabel 0x2b831, hlim 58, next-header TCP (6) payload length: 6802) 2001:41b0:fe:8::10.443 > 2001:4878:a225:3000:a00:27ff:feb1:f9b7.52364: Flags [.], cksum 0xe267 (incorrect -> 0x25a9), seq 352041:358811, ack 0, win 448, options [nop,nop,TS val 1310912325 ecr 1533571741], length 6770
1550760520.398230 08:00:27:b1:f9:b7 > 00:10:db:ff:70:02, ethertype IPv6 (0x86dd), length 114: (flowlabel 0xd773a, hlim 64, next-header TCP (6) payload length: 60) 2001:4878:a225:3000:a00:27ff:feb1:f9b7.52364 > 2001:41b0:fe:8::10.443: Flags [.], cksum 0xc811 (incorrect -> 0x1827), ack 1, win 20227, options [nop,nop,TS val 1533571880 ecr 1310912280,nop,nop,sack 3 {109675:358811}{32497:106967}{2709:31143}], length 0
1550760520.398245 00:10:db:ff:70:02 > 08:00:27:b1:f9:b7, ethertype IPv6 (0x86dd), length 6856: (flowlabel 0x2b831, hlim 58, next-header TCP (6) payload length: 6802) 2001:41b0:fe:8::10.443 > 2001:4878:a225:3000:a00:27ff:feb1:f9b7.52364: Flags [.], cksum 0xe267 (incorrect -> 0x882f), seq 358811:365581, ack 0, win 448, options [nop,nop,TS val 1310912326 ecr 1533571741], length 6770
1550760520.398253 08:00:27:b1:f9:b7 > 00:10:db:ff:70:02, ethertype IPv6 (0x86dd), length 114: (flowlabel 0xd773a, hlim 64, next-header TCP (6) payload length: 60) 2001:4878:a225:3000:a00:27ff:feb1:f9b7.52364 > 2001:41b0:fe:8::10.443: Flags [.], cksum 0xc811 (incorrect -> 0xfdb4), ack 1, win 20227, options [nop,nop,TS val 1533571880 ecr 1310912280,nop,nop,sack 3 {109675:365581}{32497:106967}{2709:31143}], length 0
1550760520.398286 00:10:db:ff:70:02 > 08:00:27:b1:f9:b7, ethertype IPv6 (0x86dd), length 4148: (flowlabel 0x2b831, hlim 58, next-header TCP (6) payload length: 4094) 2001:41b0:fe:8::10.443 > 2001:4878:a225:3000:a00:27ff:feb1:f9b7.52364: Flags [.], cksum 0xd7d3 (incorrect -> 0x78ee), seq 365581:369643, ack 0, win 448, options [nop,nop,TS val 1310912327 ecr 1533571741], length 4062
1550760520.398296 08:00:27:b1:f9:b7 > 00:10:db:ff:70:02, ethertype IPv6 (0x86dd), length 114: (flowlabel 0xd773a, hlim 64, next-header TCP (6) payload length: 60) 2001:4878:a225:3000:a00:27ff:feb1:f9b7.52364 > 2001:41b0:fe:8::10.443: Flags [.], cksum 0xc811 (incorrect -> 0xedd6), ack 1, win 20227, options [nop,nop,TS val 1533571880 ecr 1310912280,nop,nop,sack 3 {109675:369643}{32497:106967}{2709:31143}], length 0
1550760520.399237 00:10:db:ff:70:02 > 08:00:27:b1:f9:b7, ethertype IPv6 (0x86dd), length 6856: (flowlabel 0x2b831, hlim 58, next-header TCP (6) payload length: 6802) 2001:41b0:fe:8::10.443 > 2001:4878:a225:3000:a00:27ff:feb1:f9b7.52364: Flags [.], cksum 0xe267 (incorrect -> 0x135f), seq 369643:376413, ack 0, win 448, options [nop,nop,TS val 1310912327 ecr 1533571741], length 6770
1550760520.399262 08:00:27:b1:f9:b7 > 00:10:db:ff:70:02, ethertype IPv6 (0x86dd), length 114: (flowlabel 0xd773a, hlim 64, next-header TCP (6) payload length: 60) 2001:4878:a225:3000:a00:27ff:feb1:f9b7.52364 > 2001:41b0:fe:8::10.443: Flags [.], cksum 0xc811 (incorrect -> 0xd363), ack 1, win 20227, options [nop,nop,TS val 1533571881 ecr 1310912280,nop,nop,sack 3 {109675:376413}{32497:106967}{2709:31143}], length 0
1550760520.399314 00:10:db:ff:70:02 > 08:00:27:b1:f9:b7, ethertype IPv6 (0x86dd), length 6856: (flowlabel 0x2b831, hlim 58, next-header TCP (6) payload length: 6802) 2001:41b0:fe:8::10.443 > 2001:4878:a225:3000:a00:27ff:feb1:f9b7.52364: Flags [.], cksum 0xe267 (incorrect -> 0xd6aa), seq 376413:383183, ack 0, win 448, options [nop,nop,TS val 1310912328 ecr 1533571741], length 6770
1550760520.399327 08:00:27:b1:f9:b7 > 00:10:db:ff:70:02, ethertype IPv6 (0x86dd), length 114: (flowlabel 0xd773a, hlim 64, next-header TCP (6) payload length: 60) 2001:4878:a225:3000:a00:27ff:feb1:f9b7.52364 > 2001:41b0:fe:8::10.443: Flags [.], cksum 0xc811 (incorrect -> 0xb8f1), ack 1, win 20227, options [nop,nop,TS val 1533571881 ecr 1310912280,nop,nop,sack 3 {109675:383183}{32497:106967}{2709:31143}], length 0
1550760520.413276 00:10:db:ff:70:02 > 08:00:27:b1:f9:b7, ethertype IPv6 (0x86dd), length 5502: (flowlabel 0x2b831, hlim 58, next-header TCP (6) payload length: 5448) 2001:41b0:fe:8::10.443 > 2001:4878:a225:3000:a00:27ff:feb1:f9b7.52364: Flags [.], cksum 0xdd1d (incorrect -> 0xaf44), seq 383183:388599, ack 0, win 448, options [nop,nop,TS val 1310912329 ecr 1533571741], length 5416
1550760520.413311 08:00:27:b1:f9:b7 > 00:10:db:ff:70:02, ethertype IPv6 (0x86dd), length 114: (flowlabel 0xd773a, hlim 64, next-header TCP (6) payload length: 60) 2001:4878:a225:3000:a00:27ff:feb1:f9b7.52364 > 2001:41b0:fe:8::10.443: Flags [.], cksum 0xc811 (incorrect -> 0xa3bb), ack 1, win 20227, options [nop,nop,TS val 1533571895 ecr 1310912280,nop,nop,sack 3 {109675:388599}{32497:106967}{2709:31143}], length 0
1550760520.415300 00:10:db:ff:70:02 > 08:00:27:b1:f9:b7, ethertype IPv6 (0x86dd), length 1440: (flowlabel 0x2b831, hlim 58, next-header TCP (6) payload length: 1386) 2001:41b0:fe:8::10.443 > 2001:4878:a225:3000:a00:27ff:feb1:f9b7.52364: Flags [.], cksum 0xa9a3 (correct), seq 388599:389953, ack 0, win 448, options [nop,nop,TS val 1310912329 ecr 1533571741], length 1354
1550760520.415338 08:00:27:b1:f9:b7 > 00:10:db:ff:70:02, ethertype IPv6 (0x86dd), length 114: (flowlabel 0xd773a, hlim 64, next-header TCP (6) payload length: 60) 2001:4878:a225:3000:a00:27ff:feb1:f9b7.52364 > 2001:41b0:fe:8::10.443: Flags [.], cksum 0xc811 (incorrect -> 0x9e6f), ack 1, win 20227, options [nop,nop,TS val 1533571897 ecr 1310912280,nop,nop,sack 3 {109675:389953}{32497:106967}{2709:31143}], length 0
1550760520.415375 00:10:db:ff:70:02 > 08:00:27:b1:f9:b7, ethertype IPv6 (0x86dd), length 10918: (flowlabel 0x2b831, hlim 58, next-header TCP (6) payload length: 10864) 2001:41b0:fe:8::10.443 > 2001:4878:a225:3000:a00:27ff:feb1:f9b7.52364: Flags [.], cksum 0xf245 (incorrect -> 0x02d3), seq 389953:400785, ack 0, win 448, options [nop,nop,TS val 1310912330 ecr 1533571741], length 10832
1550760520.415389 08:00:27:b1:f9:b7 > 00:10:db:ff:70:02, ethertype IPv6 (0x86dd), length 114: (flowlabel 0xd773a, hlim 64, next-header TCP (6) payload length: 60) 2001:4878:a225:3000:a00:27ff:feb1:f9b7.52364 > 2001:41b0:fe:8::10.443: Flags [.], cksum 0xc811 (incorrect -> 0x741f), ack 1, win 20227, options [nop,nop,TS val 1533571897 ecr 1310912280,nop,nop,sack 3 {109675:400785}{32497:106967}{2709:31143}], length 0
1550760520.415402 00:10:db:ff:70:02 > 08:00:27:b1:f9:b7, ethertype IPv6 (0x86dd), length 6856: (flowlabel 0x2b831, hlim 58, next-header TCP (6) payload length: 6802) 2001:41b0:fe:8::10.443 > 2001:4878:a225:3000:a00:27ff:feb1:f9b7.52364: Flags [.], cksum 0xe267 (incorrect -> 0x8e89), seq 400785:407555, ack 0, win 448, options [nop,nop,TS val 1310912331 ecr 1533571741], length 6770
1550760520.415436 08:00:27:b1:f9:b7 > 00:10:db:ff:70:02, ethertype IPv6 (0x86dd), length 114: (flowlabel 0xd773a, hlim 64, next-header TCP (6) payload length: 60) 2001:4878:a225:3000:a00:27ff:feb1:f9b7.52364 > 2001:41b0:fe:8::10.443: Flags [.], cksum 0xc811 (incorrect -> 0x59ad), ack 1, win 20227, options [nop,nop,TS val 1533571897 ecr 1310912280,nop,nop,sack 3 {109675:407555}{32497:106967}{2709:31143}], length 0
1550760520.415486 00:10:db:ff:70:02 > 08:00:27:b1:f9:b7, ethertype IPv6 (0x86dd), length 6856: (flowlabel 0x2b831, hlim 58, next-header TCP (6) payload length: 6802) 2001:41b0:fe:8::10.443 > 2001:4878:a225:3000:a00:27ff:feb1:f9b7.52364: Flags [.], cksum 0xe267 (incorrect -> 0x5879), seq 407555:414325, ack 0, win 448, options [nop,nop,TS val 1310912332 ecr 1533571741], length 6770
1550760520.415498 08:00:27:b1:f9:b7 > 00:10:db:ff:70:02, ethertype IPv6 (0x86dd), length 114: (flowlabel 0xd773a, hlim 64, next-header TCP (6) payload length: 60) 2001:4878:a225:3000:a00:27ff:feb1:f9b7.52364 > 2001:41b0:fe:8::10.443: Flags [.], cksum 0xc811 (incorrect -> 0x3f3b), ack 1, win 20227, options [nop,nop,TS val 1533571897 ecr 1310912280,nop,nop,sack 3 {109675:414325}{32497:106967}{2709:31143}], length 0
1550760520.415528 00:10:db:ff:70:02 > 08:00:27:b1:f9:b7, ethertype IPv6 (0x86dd), length 5502: (flowlabel 0x2b831, hlim 58, next-header TCP (6) payload length: 5448) 2001:41b0:fe:8::10.443 > 2001:4878:a225:3000:a00:27ff:feb1:f9b7.52364: Flags [.], cksum 0xdd1d (incorrect -> 0x95cd), seq 414325:419741, ack 0, win 448, options [nop,nop,TS val 1310912333 ecr 1533571741], length 5416
1550760520.415536 08:00:27:b1:f9:b7 > 00:10:db:ff:70:02, ethertype IPv6 (0x86dd), length 114: (flowlabel 0xd773a, hlim 64, next-header TCP (6) payload length: 60) 2001:4878:a225:3000:a00:27ff:feb1:f9b7.52364 > 2001:41b0:fe:8::10.443: Flags [.], cksum 0xc811 (incorrect -> 0x2a13), ack 1, win 20227, options [nop,nop,TS val 1533571897 ecr 1310912280,nop,nop,sack 3 {109675:419741}{32497:106967}{2709:31143}], length 0
1550760520.417373 00:10:db:ff:70:02 > 08:00:27:b1:f9:b7, ethertype IPv6 (0x86dd), length 1440: (flowlabel 0x2b831, hlim 58, next-header TCP (6) payload length: 1386) 2001:41b0:fe:8::10.443 > 2001:4878:a225:3000:a00:27ff:feb1:f9b7.52364: Flags [.], cksum 0x0575 (correct), seq 419741:421095, ack 0, win 448, options [nop,nop,TS val 1310912333 ecr 1533571741], length 1354
1550760520.417415 08:00:27:b1:f9:b7 > 00:10:db:ff:70:02, ethertype IPv6 (0x86dd), length 114: (flowlabel 0xd773a, hlim 64, next-header TCP (6) payload length: 60) 2001:4878:a225:3000:a00:27ff:feb1:f9b7.52364 > 2001:41b0:fe:8::10.443: Flags [.], cksum 0xc811 (incorrect -> 0x24c7), ack 1, win 20227, options [nop,nop,TS val 1533571899 ecr 1310912280,nop,nop,sack 3 {109675:421095}{32497:106967}{2709:31143}], length 0
1550760520.417458 00:10:db:ff:70:02 > 08:00:27:b1:f9:b7, ethertype IPv6 (0x86dd), length 10918: (flowlabel 0x2b831, hlim 58, next-header TCP (6) payload length: 10864) 2001:41b0:fe:8::10.443 > 2001:4878:a225:3000:a00:27ff:feb1:f9b7.52364: Flags [.], cksum 0xf245 (incorrect -> 0x5d8a), seq 421095:431927, ack 0, win 448, options [nop,nop,TS val 1310912334 ecr 1533571741], length 10832
1550760520.417480 08:00:27:b1:f9:b7 > 00:10:db:ff:70:02, ethertype IPv6 (0x86dd), length 114: (flowlabel 0xd773a, hlim 64, next-header TCP (6) payload length: 60) 2001:4878:a225:3000:a00:27ff:feb1:f9b7.52364 > 2001:41b0:fe:8::10.443: Flags [.], cksum 0xc811 (incorrect -> 0xfa76), ack 1, win 20227, options [nop,nop,TS val 1533571899 ecr 1310912280,nop,nop,sack 3 {109675:431927}{32497:106967}{2709:31143}], length 0
1550760520.417503 00:10:db:ff:70:02 > 08:00:27:b1:f9:b7, ethertype IPv6 (0x86dd), length 6856: (flowlabel 0x2b831, hlim 58, next-header TCP (6) payload length: 6802) 2001:41b0:fe:8::10.443 > 2001:4878:a225:3000:a00:27ff:feb1:f9b7.52364: Flags [.], cksum 0xe267 (incorrect -> 0xf033), seq 431927:438697, ack 0, win 448, options [nop,nop,TS val 1310912335 ecr 1533571741], length 6770
1550760520.417517 08:00:27:b1:f9:b7 > 00:10:db:ff:70:02, ethertype IPv6 (0x86dd), length 114: (flowlabel 0xd773a, hlim 64, next-header TCP (6) payload length: 60) 2001:4878:a225:3000:a00:27ff:feb1:f9b7.52364 > 2001:41b0:fe:8::10.443: Flags [.], cksum 0xc811 (incorrect -> 0xe004), ack 1, win 20227, options [nop,nop,TS val 1533571899 ecr 1310912280,nop,nop,sack 3 {109675:438697}{32497:106967}{2709:31143}], length 0
1550760520.417576 00:10:db:ff:70:02 > 08:00:27:b1:f9:b7, ethertype IPv6 (0x86dd), length 2794: (flowlabel 0x2b831, hlim 58, next-header TCP (6) payload length: 2740) 2001:41b0:fe:8::10.443 > 2001:4878:a225:3000:a00:27ff:feb1:f9b7.52364: Flags [.], cksum 0xd289 (incorrect -> 0xb7a7), seq 1:2709, ack 0, win 448, options [nop,nop,TS val 1310912336 ecr 1533571798], length 2708
1550760520.417608 08:00:27:b1:f9:b7 > 00:10:db:ff:70:02, ethertype IPv6 (0x86dd), length 106: (flowlabel 0xd773a, hlim 64, next-header TCP (6) payload length: 52) 2001:4878:a225:3000:a00:27ff:feb1:f9b7.52364 > 2001:41b0:fe:8::10.443: Flags [.], cksum 0xc809 (incorrect -> 0x3198), ack 31143, win 19984, options [nop,nop,TS val 1533571899 ecr 1310912336,nop,nop,sack 2 {109675:438697}{32497:106967}], length 0
1550760520.417627 00:10:db:ff:70:02 > 08:00:27:b1:f9:b7, ethertype IPv6 (0x86dd), length 1440: (flowlabel 0x2b831, hlim 58, next-header TCP (6) payload length: 1386) 2001:41b0:fe:8::10.443 > 2001:4878:a225:3000:a00:27ff:feb1:f9b7.52364: Flags [.], cksum 0x06e0 (correct), seq 31143:32497, ack 0, win 448, options [nop,nop,TS val 1310912336 ecr 1533571800], length 1354
1550760520.417637 08:00:27:b1:f9:b7 > 00:10:db:ff:70:02, ethertype IPv6 (0x86dd), length 98: (flowlabel 0xd773a, hlim 64, next-header TCP (6) payload length: 44) 2001:4878:a225:3000:a00:27ff:feb1:f9b7.52364 > 2001:41b0:fe:8::10.443: Flags [.], cksum 0xc801 (incorrect -> 0x72c3), ack 106967, win 19392, options [nop,nop,TS val 1533571899 ecr 1310912336,nop,nop,sack 1 {109675:438697}], length 0
1550760520.417653 00:10:db:ff:70:02 > 08:00:27:b1:f9:b7, ethertype IPv6 (0x86dd), length 5502: (flowlabel 0x2b831, hlim 58, next-header TCP (6) payload length: 5448) 2001:41b0:fe:8::10.443 > 2001:4878:a225:3000:a00:27ff:feb1:f9b7.52364: Flags [.], cksum 0xdd1d (incorrect -> 0x6f14), seq 438697:444113, ack 0, win 448, options [nop,nop,TS val 1310912336 ecr 1533571800], length 5416
1550760520.417665 08:00:27:b1:f9:b7 > 00:10:db:ff:70:02, ethertype IPv6 (0x86dd), length 98: (flowlabel 0xd773a, hlim 64, next-header TCP (6) payload length: 44) 2001:4878:a225:3000:a00:27ff:feb1:f9b7.52364 > 2001:41b0:fe:8::10.443: Flags [.], cksum 0xc801 (incorrect -> 0x5d9b), ack 106967, win 19392, options [nop,nop,TS val 1533571899 ecr 1310912336,nop,nop,sack 1 {109675:444113}], length 0
1550760520.417700 00:10:db:ff:70:02 > 08:00:27:b1:f9:b7, ethertype IPv6 (0x86dd), length 1440: (flowlabel 0x2b831, hlim 58, next-header TCP (6) payload length: 1386) 2001:41b0:fe:8::10.443 > 2001:4878:a225:3000:a00:27ff:feb1:f9b7.52364: Flags [.], cksum 0xe75e (correct), seq 444113:445467, ack 0, win 448, options [nop,nop,TS val 1310912337 ecr 1533571800], length 1354
1550760520.417715 08:00:27:b1:f9:b7 > 00:10:db:ff:70:02, ethertype IPv6 (0x86dd), length 98: (flowlabel 0xd773a, hlim 64, next-header TCP (6) payload length: 44) 2001:4878:a225:3000:a00:27ff:feb1:f9b7.52364 > 2001:41b0:fe:8::10.443: Flags [.], cksum 0xc801 (incorrect -> 0x5851), ack 106967, win 19392, options [nop,nop,TS val 1533571899 ecr 1310912336,nop,nop,sack 1 {109675:445467}], length 0
1550760520.418090 00:10:db:ff:70:02 > 08:00:27:b1:f9:b7, ethertype IPv6 (0x86dd), length 1440: (flowlabel 0x2b831, hlim 58, next-header TCP (6) payload length: 1386) 2001:41b0:fe:8::10.443 > 2001:4878:a225:3000:a00:27ff:feb1:f9b7.52364: Flags [.], cksum 0x1f53 (correct), seq 445467:446821, ack 0, win 448, options [nop,nop,TS val 1310912337 ecr 1533571800], length 1354
1550760520.418111 08:00:27:b1:f9:b7 > 00:10:db:ff:70:02, ethertype IPv6 (0x86dd), length 98: (flowlabel 0xd773a, hlim 64, next-header TCP (6) payload length: 44) 2001:4878:a225:3000:a00:27ff:feb1:f9b7.52364 > 2001:41b0:fe:8::10.443: Flags [.], cksum 0xc801 (incorrect -> 0x5307), ack 106967, win 19392, options [nop,nop,TS val 1533571899 ecr 1310912336,nop,nop,sack 1 {109675:446821}], length 0
1550760520.419605 00:10:db:ff:70:02 > 08:00:27:b1:f9:b7, ethertype IPv6 (0x86dd), length 5502: (flowlabel 0x2b831, hlim 58, next-header TCP (6) payload length: 5448) 2001:41b0:fe:8::10.443 > 2001:4878:a225:3000:a00:27ff:feb1:f9b7.52364: Flags [.], cksum 0xdd1d (incorrect -> 0xc38a), seq 446821:452237, ack 0, win 448, options [nop,nop,TS val 1310912337 ecr 1533571800], length 5416
1550760520.419625 08:00:27:b1:f9:b7 > 00:10:db:ff:70:02, ethertype IPv6 (0x86dd), length 98: (flowlabel 0xd773a, hlim 64, next-header TCP (6) payload length: 44) 2001:4878:a225:3000:a00:27ff:feb1:f9b7.52364 > 2001:41b0:fe:8::10.443: Flags [.], cksum 0xc801 (incorrect -> 0x3ddd), ack 106967, win 19392, options [nop,nop,TS val 1533571901 ecr 1310912336,nop,nop,sack 1 {109675:452237}], length 0
1550760520.419642 00:10:db:ff:70:02 > 08:00:27:b1:f9:b7, ethertype IPv6 (0x86dd), length 6856: (flowlabel 0x2b831, hlim 58, next-header TCP (6) payload length: 6802) 2001:41b0:fe:8::10.443 > 2001:4878:a225:3000:a00:27ff:feb1:f9b7.52364: Flags [.], cksum 0xe267 (incorrect -> 0x5182), seq 452237:459007, ack 0, win 448, options [nop,nop,TS val 1310912338 ecr 1533571800], length 6770
1550760520.419647 08:00:27:b1:f9:b7 > 00:10:db:ff:70:02, ethertype IPv6 (0x86dd), length 98: (flowlabel 0xd773a, hlim 64, next-header TCP (6) payload length: 44) 2001:4878:a225:3000:a00:27ff:feb1:f9b7.52364 > 2001:41b0:fe:8::10.443: Flags [.], cksum 0xc801 (incorrect -> 0x236b), ack 106967, win 19392, options [nop,nop,TS val 1533571901 ecr 1310912336,nop,nop,sack 1 {109675:459007}], length 0
1550760520.419679 00:10:db:ff:70:02 > 08:00:27:b1:f9:b7, ethertype IPv6 (0x86dd), length 4148: (flowlabel 0x2b831, hlim 58, next-header TCP (6) payload length: 4094) 2001:41b0:fe:8::10.443 > 2001:4878:a225:3000:a00:27ff:feb1:f9b7.52364: Flags [.], cksum 0xd7d3 (incorrect -> 0x0953), seq 459007:463069, ack 0, win 448, options [nop,nop,TS val 1310912339 ecr 1533571800], length 4062
1550760520.419687 08:00:27:b1:f9:b7 > 00:10:db:ff:70:02, ethertype IPv6 (0x86dd), length 98: (flowlabel 0xd773a, hlim 64, next-header TCP (6) payload length: 44) 2001:4878:a225:3000:a00:27ff:feb1:f9b7.52364 > 2001:41b0:fe:8::10.443: Flags [.], cksum 0xc801 (incorrect -> 0x138d), ack 106967, win 19392, options [nop,nop,TS val 1533571901 ecr 1310912336,nop,nop,sack 1 {109675:463069}], length 0
1550760520.430317 00:10:db:ff:70:02 > 08:00:27:b1:f9:b7, ethertype IPv6 (0x86dd), length 5502: (flowlabel 0x2b831, hlim 58, next-header TCP (6) payload length: 5448) 2001:41b0:fe:8::10.443 > 2001:4878:a225:3000:a00:27ff:feb1:f9b7.52364: Flags [.], cksum 0xdd1d (incorrect -> 0x8380), seq 463069:468485, ack 0, win 448, options [nop,nop,TS val 1310912339 ecr 1533571800], length 5416
